Ma_BDS,Ngay_dang,Dia_chi,Dien_tich_su_dung,Dien_tich_dat,So_phong_ngu,So_nha_tam,Phap_ly,Gioi_thieu,Gia_dat
22700405,04/08/2025,"Nguyễn Ảnh Thủ, Xã Trung Chánh, Huyện Hóc Môn, TPHCM",1000 m2,624 m2 (24x26),4,6,Sổ hồng,"Bán quán CAFE “Phố Xưa” ngang 24m 3 lầu sân vườn 624m2 MTKD Nguyễn Ảnh Thủ chỉ 48 tỷ * Gia đình anh chị ruột xuất cảnh Canada cần bán nhanh quán cafe sân vườn VỊ TRÍ VÀNG NGAY MẶT TIỀN NGUYỄN ẢNH THỦ TRUNG CHÁNH HÓC MÔN VIEW QUẬN 12.* Diện tích 624m2, ngang 24m dài 26m, 100% thổ cư, thiết kế dạng sân vườn, sinh thái mát mẻ, nhiều điểm check in, chụp hình… rất nổi tiếng ở khu vực vì đã hoạt động trên 20 năm.* Bán quán café doanh thu 400 triệu hàng tháng, decor phong cách Tân cổ điển bởi kiến trúc sư người Ý.* Ngay đoạn đường sầm uất nhất của Nguyễn Ảnh Thủ, kinh doanh buôn bán đa ngành nghề, siêu thị Co.op mart, phố thời trang, trường Cao đẳng Giao thông vận tải, * Giá chỉ 48 tỷ còn thương lượng mạnh cho khách tạo cơ hội cho chủ nhà đi định cư sớm. * Sổ hồng riêng, chính chủ, thổ cư 100%, xây dựng cao tầng thoải mái. Miễn Môi giới và trung gian..! Cam kết “HÌNH THẬT, NHÀ THẬT, GIÁ CHÍNH CHỦ.” ** HÃY ĐỂ TÔI ĐỒNG HÀNH CÙNG BẠN TÌM CĂN NÀ MƠ ƯỚC** Còn rất nhiều tiện ích xung quanh để được tư vấn thêm Call/ Zalo: 0902 67 57 90 – 0932 700 782 Hồng Loan Nhà Đẹp để được gặp trực tiếp chủ nhà thương lượng giá cả. Trong muôn vàn sự lựa chọn, xin cảm ơn quý khách đã xem tin. Chuyên môi giới nhà mặt tiền kinh doanh, biệt thự, CHDV...quận Gò Vấp, Bình Thạnh, Tân Bình, Quận 12 và đất các quận huyện trung tâm TP.HCM, uy tín, tận tâm, nhiệt tình. Luôn giúp đỡ khách hàng đến với chủ nhà, sở hữu căn nhà đẹp tương lai.",48 tỷ
22600956,02/08/2025,"Song Hành, Xã Tân Xuân, Huyện Hóc Môn, TPHCM",300 m2,300 m2 (12x28),1,1,Sổ hồng,"BÁN NHÀ chính chủ - MẶT TIỀN ĐƯỜNG SONG HÀNH, HUYỆN HÓC MÔNCung đường buôn bán sầm uất, bậc nhất ở Huyện Hóc Môn, Nhà Hàng, karaoke, Khách sạn....Kết Cấu: Trệt - tầng Lửng - Đang cho thuê 45 triệu / tháng - thuận Tiện xây cao ốc văn phòng, toà nhà Căn Hộ Dịch vụ....Diện Tích: Ngang 12m x Dài 28m.  Tổng diện tích 300m2 , có Thổ Cư 250m2 - Sổ Hồng Chính Chủ , sẵn sàng công chứng.- Giá cũ 20tỷ, nay bán gấp giảm còn 19tỷ500- Hướng Tây NamGọi ngay 0779 938 978 Anh LONG để được tư vấn.",19 tỷ 500 triệu
22668604,02/08/2025,"Xuân Thới Thượng 8-4, Xã Xuân Thới Thượng, Huyện Hóc Môn, TPHCM",486 m2,138 m2 (5x28),5,6,Sổ hồng,"🔥MẶT TIỀN ĐƯỜNG XUÂN THỚI THƯỢNG - 1 TRỆT 3 LẦU + ST ĐÚC BTCT - NỘI THẤT GỖ ĐỎ XỊN NHÀ MỚI 100% FULL NỘI THẤT CAO CẤP CHỦ TẶNG TOÀN BỘ CHO KHÁCH CHI PHÍ XÂY DỰNG ~ 4 TỶ.✅ Kết cấu: 1 trệt 3 lầu, 2 sân thượng, đúc btct hoàn công đủ. Gồm sân để xe hơi, phòng khách, khu bếp, sân sau, tổng 4 phòng ngủ rộng theng thang, 5wc, 1 Phòng thờ, 2 sân thượng trước sau.✅ Nhà đẹp xây mới, nội thất cửa, bộ bếp, tủ toàn bộ bằng gỗ đỏ nhập khẩu, chủ tặng hết cho khách, mua chỉ xác vali về ở.✅ Vị trí ngay Phan Văn Hớn giao Trần Văn Mười di chuyển thuận tiện về trung tâm, tiện ích đầy đủ bán kính 1 km không thiếu thứ gì.✅ Pháp lý: Chuẩn, Sổ hồng công chứng ngay.thông tin thật hình thật tự chụp.giá rao chỉ tham khảo, khách hàng thiện chí xem nhà và làm việc trực tiếp chủ nhà và thiện chí thì giá sẽ rất tốt. mong gặp khách hàng thiện chí mua.",8 tỷ 500 triệu
22684021,01/08/2025,"Đỗ Văn Dậy, Xã Tân Hiệp, Huyện Hóc Môn, TPHCM",390 m2,130 m2 (5x26),5,4,Sổ hồng,"MẶT TIỀN ĐẸP - NHÀ ĐẸP - VỊ TRÍ ĐẸP ĐỖ VĂN DẬY - TÂN HIỆP - HÓC MÔN- Nhà mặt tiền đẹp 5m chuẩn đường Đỗ Văn Dậy.- Thiết kế: Sân để xe rộng, phòng khách, bếp và giếng trời phía sau, 4 phòng ngủ toilet khép kín, có phòng ngủ tầng trệt, phòng thờ, phòng xong hơi…,- Vị trí ngay kế bên Nhà Văn Hoá Thiếu Nhi, Cty Điện Lực Hóc Môn, Coopmart, chợ Hóc Môn…,- Nhà mặt tiền 5m chuẩn, khu vực kinh doanh sầm uất.0902677955 - 0902848978",7 tỷ 890 triệu
22691394,01/08/2025,"Dương Công Khi, Xã Tân Hiệp, Huyện Hóc Môn, TPHCM",216 m2,216 m2 (9x24),5,6,Sổ hồng,"GIÁ 14.5 TỶ - BIỆT THỰ MẶT TIỀN KHỦNG - 9M× 24M - 2 MẶT TIỀN DƯƠNG CÔNG KHI- TÂN HIỆP HÓC MÔN - Mặt tiền nhà 3 tầng, 4 phòng ngủ, phòng khách, phòng thờ, sân thượng trước sau, có phòng ngủ tầng trệt- Tiện kinh doanh mọi nghành nghề.- Vị trí đắc địa ngay góc ngã tư Dương Công Khi - Đường Thị Trấn Tân Hiệp, kế bên Ngã Ba Ông Trác, khu vực kinh doanh sầm uất gần chợ, trường học các cấp, nhà văn hoá Thiếu Nhi, Cty Điện Lực Hóc Môn, Coopmart, Chợ Hóc Môn, chùa Hoàng Pháp…,- Nhà chính chủ, công nhận đủ, hoàn công đầy đủ.☎️ 0902677955 Oanh",14 tỷ 500 triệu
22696217,26/07/2025,"Đặng Thúc Vịnh, Xã Đông Thạnh, Huyện Hóc Môn, TPHCM",,54 m2 (4x14),4,4,Sổ hồng,"Căn  nhà SHR 4x14 đúc 1 lầu gồm pk, pb, 3PN, phòng thờ 3WC có phòng ngủ dưới. Nhà mới tinh chỉ sách vali vào ở🏦 Giá bán nhanh 3TỶ360 rẻ hơn nhà trong hẽm 🏠 Mặt tiền đường ĐT 2-3-1 cách đường Đặng Thúc Vịnh 160m buôn bán mọi ngành nghề. 🎍. Nhà sổ mới hoàn công hỗ trợ khách vay ngân hàng.",3 tỷ 360 triệu
22694584,25/07/2025,"Đông Thạnh 3-2, Xã Đông Thạnh, Huyện Hóc Môn, TPHCM",,54 m2 (4x14),3,3,Sổ hồng,"bán nhà SHR 4x14 đúc 1 lầu gồm pk, pb, 3PN, phòng thờ, 3WC có phòng ngủ dưới. Nhà mới tinh chỉ sách vali vào ở🏦 Giá bán nhanh nhà mặt tiền chỉ có 3TỶ360 rẻ hơn nhà trong hẽm 🏠 Mặt tiền đường ĐT 2-3-1 cách đường Đặng Thúc Vịnh 160m buôn bán mọi ngành nghề. Xung quanh đầy đủ mọi tiện ích....🎍. Nhà sổ mới bao hoàn công hỗ trợ khách vay ngân hàng.",3 tỷ 360 triệu
22694424,04/07/2025,"Lê Lợi, Thị Trấn Hóc Môn, Huyện Hóc Môn, TPHCM",90 m2,90 m2 (5x17),4,2,Sổ đỏ,"BÁN NHÀ 1 TRỆT 1 LẦU MT ĐƯỜNG LÊ LỢI HÓC MÔN DIỆN TÍCH 90M2  SHR+ Diện tích ngang 5mX18m=90m2.Thiết kế 1 trệt 2  lầu ,4 phòng ngủ 2 phòng vệ sinh+ Nằm trong khu vực đông dân cư ,gần trường học ,thế giới di động ,dmx ..Tiện ích đầy đủ mọi thứ+ Tiềm năng tăng giá rất cao khi Hóc môn lên quận+ Thuận tiện di các hướng về Trường Chinh  7 phút ,sân bay Tân Sơn Nhất 15 phút ,trung tâm Thành Phố 20 phútPháp lý đầy đủ mua bán công chứng nhanh gọn, có đóng thuế sử dụng đất",1 tỷ 611 triệu
22381757,27/06/2025,"Nguyễn Hữu Cầu, Xã Trung Chánh, Huyện Hóc Môn, TPHCM",149 m2,149 m2 (6x25),1,1,Sổ hồng,"Gia đình cần bán dãy nhà trọ mặt tiền đường Nguyễn Hữu Cầu, Xã Trung Chánh, Hóc Môn.Vị trí ngay ngã ba Nguyễn Hữu Cầu giao với Tô Ký và Bùi Văn Ngữ.Sát bên chợ Ngã Ba Bầu, cách đường Tô Ký tầm 50m.DT: 6m x 25m . Hiện có 12 phòng trọ đang cho thuê thu nhập 20 triệu: tháng.Hướng: Tây BắcGiá: 13 tỷ 900 triệu thương lượngLh:0967813059 Quyền",13 tỷ 900 triệu
22692783,26/06/2025,"Đông Thạnh 4, Xã Đông Thạnh, Huyện Hóc Môn, TPHCM","81,8 m2","81,8 m2 (5,5x15)",2,1,Sổ hồng,"Vị Trí: 2 sẹc đường Đông Thạnh 4, Xã Đông Thạnh, Huyện Hóc Môn.Diện tích: 5,5x15 (81,8m2), MT đường nhựa 5m, 2 ô tô tránh nhau thoải mái.Kết Cấu: sân trước rộng rãi kèm lối đi bên hông, phòng khách, 2 phòng ngủ bếp, phòng ăn, phòng khách, wc.Nhà xưa cất ở nên xây rất kiên cố chỉ cần về sơn sửa lại tí là nhà như mới.Không gian nhà rộng rãi, đủ chỗ cho trẻ em chạy nhảy trong nhà.Nhà nằm ngay khu vực dân cư đông đúc, hàng xóm thân thiện, tiện ích xung quanh đầy đủ.Pháp lý sổ hồng riêng.Giá: 1 tỷ 250 (gặp chủ thương lượng trực tiếp).Liên hệ 0939.082.140 Quốc Anh để hẹn chủ và dẫn đi xem.",1 tỷ 250 triệu
22692158,23/06/2025,"Thiên Quang, Xã Trung Chánh, Huyện Hóc Môn, TPHCM",,"84 m2 (5,6x17)",3,3,Sổ hồng,"- HXH nhựa 6m, gần Siêu thị Coopmart Nguyễn Ảnh Thủ, Điện Máy Xanh, Trường Đại học Lao Động Xã Hội, Trường cấp 3 Nguyễn Hữu Cầu, Bệnh viện An Khang.- Diện tích: 4.1m x 17m, nở hậu 5.6m, xe hơi đổ trong nhà, Phòng khách, 3PN, Bếp âm Nhật Bản, Tolet sáng bóng ...- Kinh doanh, Văn phòng Công ty hoặc cho thuê 12tr/tháng.- Pháp lý rõ ràng, công chứng ngay.- Anh/chị/em quan tâm nhắn zép lào em gửi thông tin: 0933902994",3 tỷ 900 triệu
22691719,19/06/2025,"Tân Xuân 3, Xã Tân Xuân, Huyện Hóc Môn, TPHCM","55,5 m2",64 m2 (4x16),2,2,Sổ hồng,"Diện tích , kết cấu  : 4m x 16m . 1 trệt 1 lầu . sân đậu xe rộng rãi. 2 PN. 1 phòng thờ.  2 toilet .  Bếp . phòng khách.  ✅️ Vị trí: Sát Mặt tiền Tân Xuân 3 . khu vực đông dân cư . hiếm nhà bán . ✅️ Khu vực trung tâm hành chính Hóc Môn , Xung quanh chợ  , tiệm thuốc , trường học các cấp bao quanh , quán xá , cafe  .... Tiện ích không thiếu gì . Hàng xóm dân trí cao thân thiện. ✅️ Sổ Riêng . Pháp lý chuẩn  . Công chứng ngay .",3 tỷ 800 triệu
22689026,06/06/2025,"Lê Thị Hà, Xã Tân Xuân, Huyện Hóc Môn, TPHCM",800 m2,490 m2 (12x42),6,3,Sổ hồng,"CẦN BÁN NHÀ MẶT TIỀN 81 LÊ THỊ HÀ, TÂN XUÂN HÓC MÔN- VỊ TRÍ: GẦN NGÃ 4 SONG HÀNH- LÊ THỊ HÀ CHỈ 100M- DIỆN TÍCH: 12M X 42N, VUÔNG VỨT, CÔNG NHẬN 490M2 (ODT)- HIỆN TRẠNG: SÂN, MÁI CHE, NHÀ 3 TẦNG- THÍCH HỢP MUA XÂY KHO, NHÀ BIỆT THỰ,...- CHỈ TIÊU XÂY DỰNG: 1 HẦM, 1 TRỆT, 4 LẦU, ST- SỔ HỒNG CÁ NHÂN ĐỨNG TÊN- GIÁ BÁN: 46 TỶ- LIÊN HỆ: 0938 958 089 Đã sao chép ĐỂ BIẾT THÊM CHI TIẾT!(CHUYÊN TƯ VẤN NHÀ PHỐ, VILLA, BUILDING KHU VỰC HUYỆN HÓC MÔN, Q12)",46 tỷ
22682229,08/05/2025,"Đường số 17, Xã Tân Thới Nhì, Huyện Hóc Môn, TPHCM",100 m2,100 m2 (5x20),3,3,Sổ hồng,"Hot 🔥 cô 4 được con gái đón qua nước ngoài sống nên bán nhà Cấp 4 Giá 880triệu (thương lượng)SỔ HỒNG RIÊNGbao công chứng Diện tích ( ngang 5, dài 20  ) = 101m2Nhà : 1trệt  ,1 bếp ,3 nhà vệ sinh ,3phòng ngủ Địa chỉ : nằm trên đường Tân Thới Nhì 17.1 , xã Thới , Tân Thới Nhì , Hóc MônTiện ích vì cách chợ Tân Thới Nhì 500m, Chùa Mã Lai Du 2p đi xe máy  , chỉ 3phút ra QL22Liên hệ em để xem nhé : 0976895057",880 triệu
22682190,08/05/2025,"Tân Thới Nhì 1, Xã Tân Thới Nhì, Huyện Hóc Môn, TPHCM",100 m2,100 m2 (5x20),1,3,Sổ hồng,"Hot 🔥 cô 4 được con gái đón qua nước ngoài sống nên bán nhà Cấp 4  giá 880 triệuGiá 880 triệu (thương lượng) SỔ HỒNG RIÊNG bao công chứng   Diện tích ( ngang 5, dài 20  ) = 101m2 Nhà : 1 trệt  ,1 bếp ,3 nhà vệ sinh ,3 phòng ngủ  Địa chỉ : nằm trên đường Tân Thới Nhì 17.1 , xã Thới , Tân Thới Nhì , Hóc Môn Tiện ích vì cách chợ Tân Thới Nhì 500m, Chùa Mã Lai Du 2p đi xe máy  , chỉ 3phút ra QL22Liên hệ em để xem nhé :0961755564",880 triệu
22679768,04/05/2025,"Tân Hiệp 8, Xã Tân Hiệp, Huyện Hóc Môn, TPHCM",190 m2,108 m2 (6x18),4,4,Sổ hồng,"💜💜💜 NHÀ ĐÚC SHR TÂN HIỆP __ HÓC MÔM!!!🏡🏡 Bán Nhà Sổ Hồng Riêng Tân Hiệp 8, 1 trệt 1 lầu đúc bê tông cốt thép, ban công thoáng mát, thiết kế hiện đại ✨DT : 6m x 17m4 phòng ngủ 3 WC 🚗 Đường 5m thông, khu dân cư hiện hữu...GIÁ BÁN : 4 Tỷ TL Chủ ( hỗ trợ bank )_______LH: 0907 679 878 Bđs Nam Phát ccg!!!",4 tỷ
22681989,04/05/2025,"Xuân Thới Sơn 19, Xã Xuân Thới Sơn, Huyện Hóc Môn, TPHCM",160 m2,92 m2 (5x19),4,3,Sổ hồng,Chủ Cần Bán Gấp Nhà SHR Đúc Lửng : Gồm 4pnDT : 5m x19m thổ cư 92m2Vị Trí : MT Nhựa 7m Khu Dân Cư Đông Hàng Xóm Thân Thiện. Nhà / Nhựa XTS 19 vào 50m đg xe tải ok.... Cách Trần Văn Mười 600m. Cách Nhà Thờ Bùi Môm ql22 _ Chợ Đầu Mối 1.2 km...Hiện đang cho thuê Giá 7tr/ thángAlo: 0907 679 878 Bđs Nam Phát Chính Chủ TL!!!,4 tỷ 100 triệu
22470209,04/05/2025,"Xuân Thới Thượng 4, Xã Xuân Thới Thượng, Huyện Hóc Môn, TPHCM",155 m2,156 m2 (5x34),3,2,Sổ hồng,Cần bán nhà nát dt khủng 5mx35m cn 165m2nhà 1 sẹc pvh mt đg nhựa 10mkinh doanh buôn bán mọi thứ okvị trí gần ub chợ xtt. về tp 10km,5 tỷ 600 triệu
22422706,03/05/2025,"Trung Lân 1, Xã Bà Điểm, Huyện Hóc Môn, TPHCM",114 m2,114 m2 (6x19),4,4,Sổ hồng,"Nhà sổ hồng riêng 2 mặt tiền đường trung lân ,xã bà điểm ,huyện Hóc Môn  🌈Giá:2tỷ 950tr   bớt lộc khách thiện trí  -Diện tích đất xây 53m ²,dt sử dụng 114m2-Diện tích : ngang 6m dài 19m Thiết kế: xây 2 tầng 4phòng ngủ ,phòng khách ,4 tole ------------ Mặt tiền trước nhà 6m xe 10tấn ra vào hẻm hong 6m Cách Nguyễn ảnh thủ 150m Cách Nguyễn Thị sóc 350m Cách phan văn hớn 350m Gần chợ bà điểm 350m Cách ủy ban 350m --------------- -Tiện tích: Gần chợ ,trung tâm mua sắm ,trường học ,khu vui chơi ,cơ sở hạ tầng Có nguồn nước sạch",2 tỷ 950 triệu
22309165,01/05/2025,"Lê Thị Kim, Xã Xuân Thới Sơn, Huyện Hóc Môn, TPHCM",300 m2,300 m2 (10x30),2,2,Sổ hồng,"Chủ gửi 💥 SIÊU RẺ 💥 XƯỞNG 10X30M MẶT TIỀN XUÂN THỚI SƠN, SẸC LÊ THỊ KIM, NGÃ 4 HÓC MÔN, XUÂN THỚI SƠN ☘️ #8.5 tỷ tl ( Giảm 1tỷ giá cũ 9.5 tỷ)❤️ DT: 10x 30m💟 #_GIÁ_8tỷ500tr💥🏡 Sổ Hồng Riêng 300m2 đất ONT. Gồm 2 Phòng làm việc có WC riêng + xưởng sx 😍👉 VỊ TRÍ "" RẤT ĐẸP "" 👏- Xã Xuân Thới SƠN, Hóc Môn- Đường 12m thông xe công bon bon- Cách Nguyễn Văn Bứa 800m- Cách trường tiểu học Dương Công Khi và THCS Nguyễn Hồng Đào 500m- Cách ủy ban XTS 900m, chợ XTS 1km gần Vành Đai 3💫 Thích hợp cho thuê tiếp hoặc làm kho xưởng, biệt thự vườn ‼️‼️‼️ Rẻ nhất KV 🎉📞 Lh trực tiếp SĐT 0907 679 878  - 098 478 1811 ccg* Thông tin và hình ảnh thật !VP Nhà Đất Nam Phát: 18/4K1 Nguyễn Thị Thử, XTS, Hóc Môn ( Gần Gà hấp hèm 34)",8 tỷ 500 triệu
21457966,01/05/2025,"Xuân Thới Thượng 6, Xã Xuân Thới Thượng, Huyện Hóc Môn, TPHCM",400 m2,400 m2 (10x40),1,1,Sổ hồng,"👉 DT: 10x 40m, xây Full✅ GIÁ: 17 tỷ🏡 Sổ Hồng Riêng, hướng Bắc🎉 Sổ Công nhận 339m2 đất ở, còn lại đất nông nghiệp, sổ rất đẹp- MẶT TIỀN XUÂN THỚI THƯỢNG 6, tuyến đường huyết mạch thông thương, xe công chạy thoải mái không cấm đường- Mặt tiền nhựa 10m thông vỉa hè cây xanh, thoáng mát sạch sẽ- Kế bên là xưởng, cách 1 lô đất đến nhà lầu- Ngang 10 đẹp đẽ ko tóp, sau này dễ tách sổ- Đối diện hồ câu cá giải trí, tiện ích xung quanh đầy đủ chợ, trường học các cấp từ mầm non đến các cấp đầy đủ, gần KDL hồ cá Koi Nhật Bản, về cầu Tham Lương 6km, sân bay 12km- Thích hợp làm xưởng, kho, biệt thự,... Làm cái gì cũng được, kdbb gần trường học, tuyến đường huyết mạch thông thương chợ đầu mối Hóc Môn, Trần Văn Mười, ...THÔNG TIN VÀ HÌNH ẢNH THẬT !☎ Lh: 0907 679 878 - 098 478 1811Nhà Đất Nam Phát ( Nhà Thật - Giá Thật ). Xin cảm ơn !",17 tỷ
21430693,01/05/2025,"Trần Văn Mười, Xã Xuân Thới Thượng, Huyện Hóc Môn, TPHCM",269 m2,"269 m2 (7,5x32)",,,Sổ hồng,"Kẹt tiền lắm rồi, bán gấp: 12 tỷ🔥 Hàng thơm: Nhà nát Mặt Tiền Trần Văn Mười, Hóc Môn. Ngay gần đèn đỏ chợ Đại Hải, Vinmart, BHX. Kdbb sầm uất khúc sung nhất. Cách đèn đỏ chợ Đại Hải ( Trần Văn Mười giao Phan Văn Hớn) mấy chục mét. Bán cái gĩ cũng đông khách đắt hàng!👉 Dt: 7.5x32m, nở hậu✔ Tổng dt 269m2 có 150m2 thổ cư, gồm 3 sổ giá cũ 16 tỷ thương lượng GIÁ RẺ NHẤT khu vực- NAY KẸT TIỀN GIẢM MẠNH 12 tỷ☎ lh: 0907 679 878 - 098 478 1811(Nhà Đất Nam Phát - 18/4k1 nguyễn thị thử, xts hóc môn )Kẹt tiền lắm rồi, bán gấp giá tốt cho khách thiện chí",12 tỷ
21419225,01/05/2025,"Trần Văn Mười, Xã Xuân Thới Đông, Huyện Hóc Môn, TPHCM",200 m2,200 m2 (5x40),3,2,Sổ hồng,"HÀNG THƠM:Anh chủ Kẹt tiền lắm rồi. Bán gấp  Nhà Mặt tiền Trần Văn mười - KDBB SẦM UẤT ngay chợ 10.5 tỷ đang cho thuê 15 triệu/ tháng , sung túc --------------------👉 Dt: 5x36m. Xây dựng sử dụng full- KDC Hiện Hữu, lộ giới đg TVM 30m vẫn còn dài 28m( 135m) đất ở đô thị ( 5x28m). Sổ đẹp tuyệt vời !!!☎ lh: 0907 679 878 - 098 478 1811( lh trực tiếp chủ gửi giá tốt nhất Hóc Môn)Nhanh tay thì còn. Xin cảm ơn!!!",10 tỷ 300 triệu
22335347,01/05/2025,"Nguyễn Thị Thử, Xã Xuân Thới Thượng, Huyện Hóc Môn, TPHCM",640 m2,640 m2 (16x40),2,2,Sổ hồng,"Rẻ quá 💥VỊ TRÍ QUÁ ĐẸP💥 Xưởng MT XTT6 ( Nguyễn Thị Thử gần Hồ Sinh Thái Hóc Môn) 💥 Hot💥❤️ DT 16m x 40m 💟 Giá Bán 16 Tỷ ( rẻ nhất kv )Tính ra Khoảng 25tr/m2 👉 Rất rẻ ‼️👉 Đang cho Thuê 35tr/ tháng, thu nhập ổn định mỗi tháng👉 Gần chợ, trường học, siêu thị- Đường xe công bon bon. ko cấm đường cấm xe, vỉa hè rộng- Gần kênh liên xã đang làm, hồ sinh thái Hóc Môn vài trăm mét. Tương lai cực kì phát triển 💯💯- Cách Phan Văn Hớn chỉ 250m, Thông Trần Văn Mười 200m,... đường xá thuận lợi về ngã 4 Hóc Môn, Ngã 4 giếng nước hay Phan Văn Hớn,... thông thương nhiều hướng💥 Mua đầu tư lời 👏 Tương lai quy hoạch xung quanh rất đẹp, làm gì cũng được, biệt thự, kho, xưởng, dãy trọ, tách thửa sinh lời📞 0907 679 878 bđs Nam PhátTHÔNG TIN VÀ HÌNH ẢNH THẬTĐC: VP NHÀ ĐẤT NAM PHÁT: 18/4K1 NGUYỄN THỊ THỬ, XTS HÓC MÔN ( GẦN GÀ HẤP HÈM 34 )",16 tỷ
22300941,01/05/2025,"Nguyễn Ảnh Thủ, Xã Bà Điểm, Huyện Hóc Môn, TPHCM","156,9 m2","156,9 m2 (5x30)",2,2,Sổ hồng,"Hạ giá thẳng 1 tỷ từ 6,5 tỷ xuống 5.5 tỷ ☘️ MẶT TIỀN TÂY LÂN 1 GẦN MŨI TÀU NGUYỄN ẢNH THỦ-NGUYỄN THỊ SÓC, GẦN CHỢ BÀ ĐIỂM HÓC MÔN ☘️ #5tỷ5❤ DT: 5 x 31m💟 #_GIÁ_5tỷ500tr ( giá cũ 6 tỷ)👉 Tính ra chỉ 35tr/m2 đất ở Mặt tiền Bà Điểm 👏💥🏡 Nhà c4, SHR hướng Đông Bắc, KDC HIỆN HỮU. Cn đủ 156.m2 đất ở đô thị 😍- Đường nhánh Ng Ảnh Thủ, 1 sẹc thẳng, tiện kdbb- Xã Bà Điểm, HM- Đường nhựa 10m thông- Dân cư đông đúc, tiện vừa ở vừa kdbb💫 Gần chợ Bà Điểm, ngã 4 Trung Chánh, ngã 3 Củ Cải chợ đầu mối HM... ‼️‼️‼️- Vị trí đẹp. Tiện vừa ở vừ KDBB làm Văn phòng, cty,...xây biệt thự phố📞 0907 679 878 - 098 478 1811 ccg* Thông tin và hình ảnh thật !VP Nhà Đất Nam Phát: 18/4K1 Nguyễn Thị Thử, XTS, Hóc Môn ( Gần Gà hấp hèm 34)",5 tỷ 500 triệu
22003515,01/05/2025,"Đỗ Văn Dậy, Xã Tân Hiệp, Huyện Hóc Môn, TPHCM",300 m2,180 m2 (10x18),5,3,Sổ hồng,"Giảm 400tr: ☘️ BIỆT THỰ ĐẸP MỚI XÂY 10 x 18 M GÓC 2 MẶT TIỀN HẺM ĐỖ VĂN DẬY 16, TÂN HIỆP HÓC MÔN ☘️❤️ DT: 10 x 18 M💟 #_GIÁ_6tỷ300tr gặp chính chủ. Nay kẹt giảm còn 5.9 tỷ tL- Hẻm xe hơi. Góc 2 MT thoáng mát 😍- Cách Đỗ Văn Dậy 100m💥 Nhà mới, sạch đẹp vô ở liền. Đang trống giao ngay. Nội thất cao cấp, hiện đại📞 0907 679 878 - 098 478 1811 ccg* THÔNG TIN VÀ HÌNH ẢNH THẬT !!!* VP NHÀ ĐẤT NAM PHÁT: 18/4K1 NGUYỄN THỊ THỬ, XTS HÓC MÔN ( GẦN GÀ HẤP HÈM 34 )",5 tỷ 900 triệu
21998566,01/05/2025,"Phan Văn Hớn, Xã Xuân Thới Thượng, Huyện Hóc Môn, TPHCM",450 m2,288 m2 (12x24),5,5,Sổ hồng,"HẠ GIÁ 800TR: ☘️ BIỆT THỰ ĐẸP QUÁ - MẶT TIỀN XUÂN THỚI THƯỢNG GẦN CHỢ XUÂN THỚI THƯỢNG, PHAN VĂN HỚN HÓC MÔN ☘️❤️ DT: 12 x 24 M, nở hậu💟 #_GIÁ_13tỷ gặp chủ làm việc🏡 Biệt thự đúc tấm BTCT kiên cố chắc chắn. Mái cũng đúc + dán gạch. Đang trống giao ngay 😍- Mặt tiền nhựa 10m thông, cách Phan Văn Hớn 150m- Dân cư yên tĩnh, an ninh- Khu vực Toàn biệt thự nhà vườn, xe hơi chạy bon bon💥 Tiện ích xung quanh khỏi chê, chợ trường học, ủy ban...đi bộ xíu là tới. THIỆN CHÍ GẶP CHỦ LIỀN, MUA BÁN NHANH LẸ GIÁ TỐT, SHR CÔNG CHỨNG NGAY📞 0907 679 878 - 0946 79 878 ccg* THÔNG TIN VÀ HÌNH ẢNH THẬT !* VP NHÀ ĐẤT NAM PHÁT : 18/4K1 NGUYỄN THỊ THỬ, XTS HÓC MÔN ( GẦN GÀ HẤP HÈM 34 )",13 tỷ
21017609,01/05/2025,"Nguyễn Ảnh Thủ, Xã Bà Điểm, Huyện Hóc Môn, TPHCM",152 m2,76 m2 (4x19),3,2,Sổ hồng,"NHÀ 2 MẶT TIỀN NGUYỄN ẢNH THỦ, BÀ ĐIỂM GẦN NGÃ 4 TRUNG CHÁNH, TTVH Q.12, HÓC MÔN - VỊ TRÍ ĐẸP 6 TỶ GẶP CHỦ 🔥• Nhà mới, 01 lầu dt 4x19m (3pn)• Sổ hồng riêng, vị trí sung nhất tuyến đường, thuận tiện kinh doanh đa ngành nghề.💰 Giá bán: 4.9 tỷ cũ 6 tỷ👉 Vị trí:- Mặt tiền Nguyễn Ảnh Thủ- Cách mũi tàu Nguyễn Thị Sóc 100m- Cách chợ Bà Điểm 350m- Cách ngã 4 Trung Chánh 900m- Đầy đủ tiện ích xung quanh!👉 Thông tin và hình ảnh thực tế chính xác!☎ Lh: 0907 679 878❤ NHÀ ĐẤT NAM PHÁT - SỐ: 7/4N TRẦN VĂN MƯỜI - ẤP 3XTT - HÓC MÔN ( ĐỐI DIỆN CF HƯƠNG XƯA)",4 triệu 900 nghìn
22671503,01/05/2025,"Phan Văn Hớn, Xã Bà Điểm, Huyện Hóc Môn, TPHCM",90 m2,"50 m2 (4,2x12)",2,2,Giấy tờ hợp lệ,"Cg ☘️ NHANH THÌ CÒN 💥3.1 tỷ‼️‼️ GẤP 💥 Nhà 2 MT Phần Văn Hớn sát bên ngã 4 chợ Bà Điểm đang cho thu nhập 13tr/1tháng☘️ KDBB SUNG 🎉❤️ Diện tích: 4,2m dài 12mKết cấu: 1 trệt 1 lửng, 2PNPháp lý: kê khai 99 Ccvb💟 #_Giá 3,1tỷ ( RẺ )📞 0907 679 878 - 098 478 1811 ccgNhà Đất Nam Phát: 18/4K1 Nguyễn Thị Thử, XTS Hóc Môn ( gần gà hấp hèm 34)",3 tỷ 100 triệu
22572551,01/05/2025,"Trần Văn Mười, Xã Xuân Thới Đông, Huyện Hóc Môn, TPHCM",196 m2,196 m2 (5x39),2,2,Sổ hồng,"Rẻ ☘️ NHÀ C4 MT TRẦN VĂN MƯỜI GẦN CHỢ CHỮ S, ỦY BAN XÃ XUÂN THỚI ĐÔNG, HÓC MÔN❤️ DT: 5x 39m💟 #_GIÁ 8.3 TỶ- Mặt tiền TVM, KDBB sung- Gần chợ, trường học- Gần ngã 3, ngã 4 thông nhiều hướng, dân cư đông đúc, bán gì cũng đượcSổ hồng riêng. Tổng DT 196m2, trừ LG ko công nhận Sổ Công nhận 192.7m2📞 *LH trực tiếp Sđt: 0907 679 878 - 098 478 1811*👉Thông tin và hình ảnh thật. Xin cảm ơn!* VP Nhà Đất Nam Phát: 18/4K1 Nguyễn Thị Thử, XTS, Hóc Môn ( Gần gà hấp hèm 34)",8 tỷ 300 triệu
22475612,01/05/2025,"Nguyễn Thị Sáu, Xã Xuân Thới Thượng, Huyện Hóc Môn, TPHCM",250 m2,170 m2 (10x18),4,5,Sổ hồng,"Chính Chủ : Cần Bán Nhà+ Đất . Hiện cho cty thuê 15tr/thángVị Trí : Mt nhựa 8m thông xtt59, cách chợ Đại Hải _ chợ Đầu Mối 500mDT : 10m x 18m Gồm căn nhà Xd 5x18m đúc 3 lầu sân thượng + lô đất trồng rau nuôi gà 5x18mGiá bán : 6.7 Tỷ Lv chủ ( Tính giá rẻ bán nhà tặng đất)____LH: 0907 679 878 Bđs Nam Phát ccg",6 tỷ 700 triệu
22299558,01/05/2025,"Phan Văn Hớn, Xã Xuân Thới Thượng, Huyện Hóc Môn, TPHCM",630 m2,630 m2 (18x32),3,2,Sổ hồng,"Hàng thơm* KẸT TIỀN HẠ GIÁ GẦN 4 TỶ * NHÀ C4 TIỆN VỪA Ở VỪA LÀM XƯỞNG HOẶC KDBB MẶT TIỀN NHỰA THÔNG GẦN CHỢ XUÂN THỚI THƯỢNG, PHAN VĂN HỚN:* DT: 18x 32m* Tổng dt 2 sổ 630m2* Giá bán : 14 tỷ 400tr - RẺ NHẤT KHU VỰC !!* NHÀ SHR, KDC hIỆN hỮU, vị trí rất đẹp, làm biệt thự hay kho xưởng đều được- Mặt tiền nhựa thôngNguyễn Văn Bứa và Phan Văn hớn* Lh coi trực tiếp SĐT: 0907 679 878 - 0946 679 878Hàng thơm chuẩn, nhanh thì còn. Thông tin và hình ảnh thật. XIn cảm ơn !",14 tỷ 400 triệu
