Ma_BDS,Ngay_dang,Dia_chi,Dien_tich_su_dung,Dien_tich_dat,So_phong_ngu,So_nha_tam,Phap_ly,Gioi_thieu,Gia_dat
22226595,29/11/2023,"Dương Công Khi, Xã Tân Hiệp, Huyện Hóc Môn, TPHCM",265 m2,200 m2 (9x24),4,4,Sổ hồng,"CHO VỐN CON LẬP NGHIỆP BÁN NHANH NHÀ MẶT TIỀN 200M2 - KHU DÂN CƯ SẦM UẤT - GIÁ TỐT ĐẦU TƯ----------🍀🍀🍀🍀-----------Vị trí : Dương Công Khi - Tân Hiệp - TP Hóc Hôn - HCM- Giá thấp nhất khu vực  : 15 tỷ (thương lượng)- Mô tả : nhà chính chủ lâu đời , chủ mong muốn bán nhanh . Cam kết thông tin hình ảnh chuẩn ❤️- Hiện trạng : nhà 3 tầng 2 mặt thoáng , 4 phòng ngủ + phòng thờ+ phòng khách + sân thượng trước sau - Ngang 9m nở hậu 13m ✖️Dài 24m - Khu vực : dân cư đông đúc ,kinh doanh sầm uất ..... gần chợ Hóc Môn , nhà Thiếu nhi , chùa Hoằng Pháp ... giao thông vô cùng thuận lợi - Sổ hồng riêng công chứng nhanh LIÊN HỆ XEM NHÀ VÀ GẶP CHÍNH CHỦ THƯƠNG LƯỢNG: Mr Mỹ0️⃣9️⃣0️⃣3️⃣3️⃣2️⃣9️⃣8️⃣3️⃣2️⃣0️⃣9️⃣3️⃣4️⃣4️⃣7️⃣4️⃣4️⃣5️⃣0️⃣BĐS UY TÍN- TRAO GIÁ TRỊ- NHẬN NIỀM TIN # Tôi Là Dân Hóc Môn# Nhà mặt tiền kinh doanh # Nguồn nhà giá rẻ # Nhà phố Hocmon",15 tỷ
22236372,29/11/2023,"Nguyễn Thị Ngâu, Xã Thới Tam Thôn, Huyện Hóc Môn, TPHCM",605 m2,605 m2 (11x55),14,14,Sổ hồng,"CẦN BÁN NHÀ MẶT TIỀN KINH DOANH - DIỆN TÍCH 605M2 THỔ CƯ - PHÙ HỢP  XÂY TOÀ NHÀ & BIỆT THỰ & LÀM XƯỞNG SX - GIÁ CHỐT CỰC SỐC - KHU VỰC TIỀM NĂNG KINH TẾ  PHÁT TRIỂN HÓC MÔN -------------🌺🌺🌺-----------Đ/c : Nguyễn Thị Ngâu - Thới Tam Thôn - Hóc Môn - TPHCM - Giá : thấp nhất thị trường thiện chí liên hệ - Hiện trạng: 1 nhà cấp 4 và 10 phòng trọ đang cho thuê có lối đi riêng biệt , mặt tiền đường 16m có vỉa hè - Ngang 11m ✖️dài 55m . Diện tích 590m2  thực tế 605m2 hoàn toàn thổ cư😍- Ưu điểm :giá tốt phù hợp mua đầu tư giữ tiền , xây xưởng lâu đài biệt thự ...vv kinh doanh đa nghành nghề- Vị trí : khu vực đang phát triển thần tốc của Hóc Môn , sát cạnh các trục đường lớn huyết mạch như Tô Kí - Đặng Thúc Vịnh .... chợ đầu mối  giao thông - giao thương dễ dàng thuận lợi 😍- Sổ hồng riêng chính chủ . Cam kết thông tin hình ảnh chuẩn LIÊN HỆ XEM NHÀ VÀ GẶP TRỰC TIẾP CHỦ THƯƠNG LƯỢNG : Mr Mỹ0️⃣9️⃣0️⃣3️⃣3️⃣2️⃣9️⃣8️⃣3️⃣2️⃣0️⃣9️⃣3️⃣4️⃣4️⃣7️⃣4️⃣4️⃣5️⃣0️⃣BĐS UY TÍN- TRAO GIÁ TRỊ- NHẬN NIỀM TIN # Tôi là dân Hóc Môn # mặt tiền kinh doanh # bất động sản thổ cư #bất động sản giá ngộp",17 tỷ
22394833,29/11/2023,"Xuân Thới Sơn 27, Xã Xuân Thới Sơn, Huyện Hóc Môn, TPHCM",300 m2,276 m2 (10x30),2,2,Sổ hồng,"BÁN NHÀ MẶT TIỀN LÔ GÓC - 300M2  - TẶNG XƯỞNG SX VÍ DA XUẤT KHẨU CÙNG TOÀN BỘ CÔNG NHÂN LÀNH NGHỀ -GIÁ RẺ CỰC SỐC -----------🌺🌺🌺------------Đ/C : Xuân Thới Sơn 27 - Hóc Môn - TPHCM- Mô tả : mặt tiền đường 12m , lô góc cực thoáng- Diện tích : 276m2  Sử dụng : 300m2 - Ngang : 10m  Sâu : 30m- Hiện trạng : 1 trệt 1 lầu đang làm kho xưởng sản xuất ví da xuất Nhật - Vị trí : gần ngã tư Hóc Môn - QL22... khu vực dân cư đông đúc kinh doanh đa nghành tiệm ích đầy đủ : chợ , Bv , trường học ...vvv- Pháp lý : rõ ràng, sổ hồng riêng - GIÁ SỐC :  12 TỶ 🤩-----------------------------------LIÊN HỆ XEM NHÀ VÀ LÀM VIỆC CHÍNH CHỦ: Mr Mỹ 0️⃣9️⃣0️⃣3️⃣3️⃣2️⃣9️⃣8️⃣3️⃣2️⃣0️⃣9️⃣3️⃣4️⃣4️⃣6️⃣4️⃣4️⃣5️⃣0️⃣BĐS UY TÍN - TẬN TÂM - TRAO GIÁ TRỊ - NHẬN NIỀM TIN",12 tỷ
22226338,29/11/2023,"Tân Hiệp 10, Xã Tân Hiệp, Huyện Hóc Môn, TPHCM",143 m2,"143 m2 (5,3x27)",3,1,Sổ hồng,"CHÍNH CHỦ BÁN GẤP NHÀ MẶT TIỀN 143M2 XÂY FULL - TOẠ LẠC NGAY THÀNH PHỐ HÓC MÔN - GIÁ CỰC SỐC CHỈ  4️⃣TỶ 1️⃣9️⃣9️⃣TRIỆU -----------🍀🍀🍀------------Đ/c : TÂN HIỆP 10 - XÃ TÂN HIỆP - HÓC MÔN -Hiện trạng : nhà cấp 4 , 3pn ,mặt tiền đường 12m có vỉa hè , hiện đang cho thuê thu nhập ổn định - Thích hợp xây mới đầu tư giữ tiền - Ngang 5.3m x dài 27m . Tổng diện tích : 143m2 - Vị trí : gần UBND xã Tân Hiệp , chợ đầu mối Hóc môn , khu dân cư đông đúc ... giao thông kết nối các trục đường Dương Công Khi - Huỳng Thị Mài - Tỉnh lộ 15 - Sổ hồng chính chủ công chứng trong ngày HỔ TRỢ XEM NHÀ VÀ LÀM VIỆC CHÍNH CHỦ VỚI PHÍ 0Đ: Mr Mỹ 0️⃣9️⃣0️⃣3️⃣3️⃣2️⃣9️⃣8️⃣3️⃣2️⃣0️⃣9️⃣3️⃣4️⃣4️⃣7️⃣4️⃣4️⃣5️⃣0️⃣BĐS UY TÍN- TRAO GIÁ TRỊ- NHẬN NIỀM TIN",4 tỷ 199 triệu
22226372,29/11/2023,"Nguyễn Thị Ngâu, Xã Thới Tam Thôn, Huyện Hóc Môn, TPHCM",605 m2,590 m2 (11x55),12,12,Sổ hồng,"CẦN BÁN NHÀ MẶT TIỀN KINH DOANH - DIỆN TÍCH 605M2 THỔ CƯ - PHÙ HỢP  XÂY TOÀ NHÀ & BIỆT THỰ & LÀM XƯỞNG SX - GIÁ CHỐT CỰC SỐC - KHU VỰC TIỀM NĂNG KINH TẾ  PHÁT TRIỂN HÓC MÔN -------------🌺🌺🌺-----------Đ/c : Nguyễn Thị Ngâu - Thới Tam Thôn - Hóc Môn - TPHCM - Giá : thấp nhất thị trường thiện chí liên hệ - Hiện trạng: 1 nhà cấp 4 và 10 phòng trọ đang cho thuê có lối đi riêng biệt , mặt tiền đường 16m có vỉa hè - Ngang 11m ✖️dài 55m . Diện tích 590m2  thực tế 605m2 hoàn toàn thổ cư😍- Ưu điểm :giá tốt phù hợp mua đầu tư giữ tiền , xây xưởng lâu đài biệt thự ...vv kinh doanh đa nghành nghề- Vị trí : khu vực đang phát triển thần tốc của Hóc Môn , sát cạnh các trục đường lớn huyết mạch như Tô Kí - Đặng Thúc Vịnh .... chợ đầu mối  giao thông - giao thương dễ dàng thuận lợi 😍- Sổ hồng riêng chính chủ . Cam kết thông tin hình ảnh chuẩn LIÊN HỆ XEM NHÀ VÀ GẶP TRỰC TIẾP CHỦ THƯƠNG LƯỢNG : Mr Mỹ0️⃣9️⃣0️⃣3️⃣3️⃣2️⃣9️⃣8️⃣3️⃣2️⃣0️⃣9️⃣3️⃣4️⃣4️⃣7️⃣4️⃣4️⃣5️⃣0️⃣BĐS UY TÍN- TRAO GIÁ TRỊ- NHẬN NIỀM TIN # Tôi là dân Hóc Môn # mặt tiền kinh doanh # bất động sản thổ cư #bất động sản giá ngộp",17 tỷ
22411003,22/11/2023,"Nguyễn Văn Bứa, Xã Xuân Thới Sơn, Huyện Hóc Môn, TPHCM",60 m2,60 m2 (4x15),2,2,Sổ hồng,". Gia đình ket tiền vay vốn cần sang gấp nhà mới xây (ĐỂ LẠI NỘI THẤT LUÔN)..Vị trí : Ngay chợ Nhị Xuân. 2pn,2wc ( có sân trước ).Dt : 4x15.Giá 435tr. Sổ sách pháp lý đầy đủ. Đường trước nhà 5m, đậu oto thoải mái, đường thông ra đường lớn. Xung quanh tiện ích đầy đủ ( trường học, bệnh viện, chợ, quán ăn uống,..). Gia đình bán gấp nếu gặp người thiện chí liên hệ trực tiếp để coi nhà.",435 triệu
22403684,16/11/2023,"Đồng Tâm, Xã Tân Xuân, Huyện Hóc Môn, TPHCM",115 m2,"196 m2 (8,2x17)",4,3,Sổ hồng,"+ Diện tích: 196m² - thổ cư 113m².+ Mặt tiền: 8.2m.+ Đường nhựa mới 8m².Ngay giao lộ Đồng Tâm - Song Hành. 1 nửa mặt tiền đang cho thuê làm tiệm cơm gà. Gần trường huflit, thuận tiện cho sinh viên thuê. Gần siêu thị, trường học, đầy đủ tiện nghi.+ Sổ hồng đầy đủ.+ Giá 8tỷ3 thương lượng được.Vui lòng add zalo",8 tỷ 300 triệu
22402199,15/11/2023,"Phan Văn Hớn, Xã Xuân Thới Thượng, Huyện Hóc Môn, TPHCM",80 m2,50 m2 (5x10),2,2,Sổ hồng,"giá 100% (1 trệt+1 lỮN) _2PN, được vay- Nhà mới xây, bố trí hiện đại, view đẹp, ban công rộng, gần ngay chợ, tiện kinh doanh mua bán.- Nội thất : có bộ bàn ghế sofa, tủ quần áo, tủ bếp , bếp từ hồng ngoại, có giường ngủ, nệm cao su..- Sổ hồng riêng_đã bao gồm tiền thuế và giấy tờ sang tên.- chỉ cần trả trước 50% / nhận nhà ngay.Khu dân cư cực kỳ an ninh, đường cao ráo, không bi ngập nước..........",650 triệu
22401592,15/11/2023,"Xuân Thới Thượng 27, Xã Xuân Thới Thượng, Huyện Hóc Môn, TPHCM",160 m2,60 m2 (5x12),3,3,Sổ hồng,🔥Bán nhà ở đang cho thuê 4tr/tháng chủ kẹt tiền nên cần bán gấp👉Giá thương lượng👉Diện tích:4x12👉Nhà hẻm xe hơi rộng rãi👉Cách chợ 500m Nhị XUân hóc MÔn👉Gần trường học thuận tiện cho con cái đi học trường cấp 2 và cấp 3👉Nhà còn mới☎️Gọi trực tiếp *** hoặc ib trực tiếp có zalo,790 triệu
22273256,11/11/2023,"Phan Văn Hớn, Xã Bà Điểm, Huyện Hóc Môn, TPHCM",263 m2,"263 m2 (6,5x41)",4,3,Sổ hồng,"+ Vị trí đỉnh gần ngã tư Nguyễn Ảnh Thủ giao Phan Văn Hớn, ngang lớn 6.5m, đang kinh doanh quán ăn, thu nhập khủng.+ Diện tích khuôn viên đang sử dụng 6.5x41m, gồm nhà 3 tầng và quán ăn phía trước.+ Khu kinh doanh sầm uất, buôn bán tập nập, phù hợp tất cả các ngành nghề kinh doanh.+ Sổ hồng, gấp bán, giá chốt bất ngờ.",10 tỷ 500 triệu
22313165,11/11/2023,"Nguyễn Thị Thử, Xã Xuân Thới Sơn, Huyện Hóc Môn, TPHCM",230 m2,230 m2 (5x48),1,1,Sổ hồng,"- Mặt tiền đường sầm uất khu vực Xuân Thới Sơn tập trung rất nhiều Công ty may.- Thỗ cư 100%, DT 5x48m, hiện trạng có thể làm xưởng sản xuất hoặc kinh doanh đa ngành.- Tiện ích bao quanh gần Trường, chô, giao thông thuận thiện kết nối Nguyễn Văn Bứa, Phan Văn Hớn, Võ Thị Hồi, Trần Văn Mười.- Sỗ hồng, Pháp lý chuẩn.",6 tỷ 600 triệu
22363946,11/11/2023,"Phan Văn Hớn, Xã Xuân Thới Thượng, Huyện Hóc Môn, TPHCM",400 m2,240 m2 (5x50),4,3,Sổ hồng,"* Kết cấu: 1 Trệt 2 Lầu, 4 Phòng Ngủ, 3 WC,đang cho thuê kinh doanh buôn bán gần 30tr/tháng.*  Vị trí: Sát bên Chợ Đại Hải, khu buôn bán kinh doanh sầm uất bậc nhất Phan Văn Hớn, Hóc Môn. * Khu vực tập trung nhiều cửa hàng, siêu thị, chợ, Ngân hàng, UBND.... Tiện ích xung quanh không thiếu gì.* Pháp lý chuẩn. Công chứng ngay.",14 tỷ 500 triệu
22370594,11/11/2023,"Nguyễn Văn Bứa, Xã Xuân Thới Sơn, Huyện Hóc Môn, TPHCM",128167 m2,"167 m2 (5,5x31)",3,2,Sổ hồng,"+ Vị trí đỉnh, dân cư đông đúc, gần Quốc lộ 22, ngã 3 Nguyễn Thị Thử.+ Hiện trạng nhà cấp 4 đang kinh doanh quán cơm, khu vực nhiều công nhân, thu nhập hàng tháng trên 30tr.  + Diện tích 5.5x30.5m, phù hợp khách mua xây mới lại hoặc sửa chữa kinh doanh theo từng ngành nghề mình buôn bán, diện tích ngang lớn, mặt tiền thông thoáng, có vỉa hè rất thuận tiện kinh doanh.+ Sổ hồng đẹp, Pháp lý chuẩn.",9 tỷ
22309623,11/11/2023,"Tô Ký, Xã Tân Xuân, Huyện Hóc Môn, TPHCM",60 m2,"37 m2 (3,5x11)",2,2,Sổ hồng,"+ Hiện trạng: Nhà mặt tiền 1 trệt, 1 lầu, tầng 1 để thông kinh doanh, tầng 2 có 2 PN, phòng thờ, 2WC.+ Vị trí: Cách ngã 4 Nguyễn Ảnh Thủ + Tô Ký 1km, gần ngã 3 bầu.+ Đường sầm uất rộng 30m, đã phíng đường có lề, KD đỉnh.+ Tiện Ích xung quanh không thiếu gì.+ Sỗ hồng",4 tỷ 200 triệu
22280293,11/11/2023,"Phan Văn Hớn, Xã Bà Điểm, Huyện Hóc Môn, TPHCM",180 m2,180 m2 (6x36),4,4,Sổ hồng,"+ Mặt tiền đường Phan Văn Hớn, khu vực sầu uất nhất Hóc Môn.+ Gần Nguyễn Ảnh Thủ, QL1A, đi Tân Phú, Tân Bình chỉ 10 phút.+ Hiện trạng gồm nhà 3 tầng và mặt trước cho thuê 18tr/ tháng kinh doanh quán ăn.+ Diện tích khuôn viên 6.5x41m, rợng rãi, kinh doanh gì cũng thuận tiện.+ Sỗ hồng, mua bán công chứng luôn.",10 tỷ 550 triệu
22270242,11/11/2023,"Lê Thị Hà, Xã Tân Xuân, Huyện Hóc Môn, TPHCM",88 m2,91 m2 (5x19),3,2,Sổ hồng,"+ Hiện trạng nhà 1 trệt, 1 lửng BTCT, 3PN, tiện sửa hoặc xây mới.+ Vị trí đỉnh khu phố kinh doanh ẩm thực, gia dụng, thời trang, vật liệu xây dựng,... + Nhà chính chủ 1 đời 20 năm, sổ nở hậu tài lôc.+ Gần ngã 3 Giao QUốc lộ 22, đường chính rộng rãi, sầm uất vào chợ, trung tâm thị trấn hóc môn.+ Sổ hồng, cập nhật hoàn công đầy đủ.",10 tỷ 900 triệu
22397218,10/11/2023,"Đông Thạnh 4-2, Xã Đông Thạnh, Huyện Hóc Môn, TPHCM",96 m2,"157 m2 (4,95x31)",2,1,Sổ hồng,"Cần bán nhà mặt tiền đường Đông Thạnh 4 - 2, xã Đông Thạnh, Hóc Môn.+ Diện tích: 4,95 x 31m (nở hậu: 5,15m).+ Giá: 6 tỷ (còn thương lượng).+ Quy hoạch dân cư hiện hữu, xây dựng hoàn công, không gần mồ mả.+ Vị trí đẹp, cách chợ Đông Thạnh đúng 250m, đi bộ ra chợ, đầy đủ tiện ích.+ Cạnh bên có căn nhà Diện tích 6 x 31m cũng kêu bán, giá 7ty còn TL, anh/chị nào có nhu cầu mua Diện tích lớn thì mua 2 căn luôn nhe...+ Hướng: Đông Bắc (thuộc Tây Tứ Trạch).+ Sổ hồng riêng, đã hoàn công, pháp lý sạch, bao sang tên.(Không tiếp các bạn quảng cáo, đăng tin).+ Liên hệ Zalo  :",6 tỷ
22397240,10/11/2023,"Đông Thạnh 6, Xã Đông Thạnh, Huyện Hóc Môn, TPHCM",67 m2,"199 m2 (5,8x33)",2,1,Sổ hồng,"Bán nhà mặt tiền đường Đông Thạnh 6, xã Đông Thạnh, Hóc Môn.+ Diện tích : 5,80 x 33  (nở hậu: 6,09m).+ Giá : 7tỷ150   (còn thương lượng).+ Nhà cấp 4 còn mới, mặt tiền đường kinh doanh buôn bán đa ngành...+ Khu vực dân cư đông đúc, không dính Quy hoạch, không gần mồ mả.+ Vị trí trí: Gần góc đường Đông Thạnh 4, cách trường Nguyễn Hữu Tiến chỉ 700m...+ Hướng: Tây Bắc.+ Sổ hồng riêng, đã hoàn công, pháp lý rõ ràng, công chứng trong ngày.(Không tiếp các bạn quảng cáo, đăng tin).+ Liên hệ zalo :",7 tỷ 150 triệu
22395802,09/11/2023,"Tân Hiệp 29, Xã Tân Hiệp, Huyện Hóc Môn, TPHCM",260 m2,"266 m2 (10x26,6)",1,1,Sổ hồng,"Cần bán nhà xưởng mặt tiền đường Tân Hiệp 29,xã Tân Hiệp, Hóc Môn+ Diện tích : 10 x 26 (nở hậu nhẹ) - Giá : 7ty400 còn thương lượng+ Đang cho thuê 15tr/tháng.+ Quy hoạch dân cư hiện hữu, xây dựng hoàn công, không gần mồ mả.+ Nhà xưởng xây dựng chắc chắn, dọn vào kinh doanh sản xuất ngay.+ Vị trí : sát trường Tiểu học Cầu Xáng, cách chợ nhỏ Tân Hiệp 400m, chợ Hóc Môn 2km, đây đủ tiện ích.+ Hướng : Nam (thuộc Đông Tứ Trạch)+ Sổ hồng riêng, pháp lý sạch, chủ bao sang tên.(Không tiếp các bạn quảng cáo, đăng tin).+ Liên hệ Zalo :",7 tỷ 500 triệu
22394565,08/11/2023,"Tiền Lân 17, Xã Bà Điểm, Huyện Hóc Môn, TPHCM",204 m2,160 m2 (8x20),10,10,Sổ hồng,"Bán căn nhà 2 tầng, mặt đường Tiền Lân 17, xã Bà Điểm, Hóc Môn.+ Diện tích: 8 x 20  (giá: 7ty300 TL).+ Kết cấu 1 trệt, 1 lầu, 2PN, 2WC + dãy 8 phòng trọ đang cho thuê.+ Vị trí: Mặt tiền đường Tiền Lân 17 rộng 12m, Cách chợ Bà Điểm 1.5km, thuận tiện di chuyển qua Q. Tân Bình, trung tâm TP.+ Khu vực dân cư đông đúc, gần dự án đường Song Hành Phan Văn Hớn, tương lai giá trị tăng cao.+ Hướng: Đông Bắc.+ Sổ hồng riêng, hoàn công đầy đủ, bao sang tên...(Không tiếp các bạn quảng cáo, đăng tin).+ Liên hệ Zalo:",7 tỷ 300 triệu
22392772,07/11/2023,"Tân Hiệp, Xã Tân Hiệp, Huyện Hóc Môn, TPHCM",94 m2,120 m2 (5x25),2,1,Sổ hồng,"Bán nhà mặt tiền đường Tân Hiệp 29,xã Tân Hiệp, Hóc Môn+ Diện tích : 5 × 24 (giá : 4ty100 còn TL)+ Nhà cấp 4 rộng rãi, sạch đẹp chắc chắn,2pn ,1wc, sân đậu ôtô 7 chỗ.+ Khu vực dân cư đông đúc,Quy hoạch dân cư hiện hữu, không gần mồ mã.+ Cạnh bên Trường Tiểu Học Cầu Xáng, cách chợ nhỏ Tân Hiệp 400m ,Bách Hóa Xanh 300m, đầy đủ tiện ích.+ Hướng : Nam (thuộc Đông Tứ Trạch)+ Sổ hồng riêng, đã hoàn công, pháp lý rõ ràng ,công chứng trong ngày.(Không tiếp các bạn quảng cáo, đăng tin).+ Liên hệ Zalo :",4 tỷ 100 triệu
22383063,06/11/2023,"Phan Văn Đối, Xã Bà Điểm, Huyện Hóc Môn, TPHCM",1030 m2,1030 m2 (18x60),6,6,Sổ hồng,"Chính chủ gởi, Bán nhà mặt tiền Phan Văn Đối, đường đẹp nhộn nhịp kinh doanh đa ngành nghề, kết nối quốc lộ 1A từ cả 2 phíaĐịa chỉ: Phan Văn Đối, Xã Bà Điểm, Hóc Môn Diện tích đã lên thổ cư 915m2, ngang 14m, nở hậu 18m, dài 60m2.; diện tích thực tế khoảng 1.030m2 Một phần diện tích đấ sẽ được cộng thêm do đường Phan Văn Đối được giảm lộ giới. Nhà chính chủ ở lâu năm khách thiện chí là vào việc ngay. Mặt tiền đắc địa kinh doanh sầm uất. Tiện ích xung quanh đầy đủ.Sổ hồng chính chủ mua bán công chứng nhanh. Gọi ngay để biết thông tin chi tiết P/s: Vì nhiều lý do nên không thể đăng hình thật, anh chị nào quan tâm inbox Lợi gửi hình ảnh anh chị tham khảo.",44 tỷ 500 triệu
22381679,06/11/2023,"Bùi Văn Ngữ, Xã Thới Tam Thôn, Huyện Hóc Môn, TPHCM",530 m2,530 m2 (10x53),3,3,Sổ hồng,"Chính chủ gởi, Bán nhà MT chợ Bùi Văn Ngữ diện tích lớn, khu kinh doanh buôn bán nhộn nhịp- Diện tích: 10 x 53 m; 530m2; trừ lộ giới còn khoảng 492m2- Hiện trạng: Nhà cấp 4 mặt tiền chợ, diện tích lớn, ngang rộng- Vi trí: khu kinh doanh sầm uất Bùi Văn Ngữ, ra Nguyễn Ảnh Thủ và ra Tô KýGọi ngay cho mình để lấy chìa khoá xem nhà!(Hình minh họa)",33 tỷ
22359657,06/11/2023,"Dương Công Khi, Xã Xuân Thới Thượng, Huyện Hóc Môn, TPHCM",1800 m2,1800 m2 (21x55),4,4,Sổ hồng,"Chính chủ gởi, Phát hiện tổ hợp Biệt thự + Kho xưởng - giấy phép xưởng cơ khí - gần Vành Đai 3 - Hóc Môn giảm sâu Địa chỉ: Góc 2 mặt tiền đường nội bộ, đường Liên Ấp 1 - Xã Xuân Thới Thượng - Hóc MônDiện tích: hơn 1800m2; xưởng cũ Ngang 21m, nở hậu 55m, dài 55m1/ Tài sản 1: biệt thự+ Biệt thự xây dựng ngang 10 x11m, vừa là văn phòng làm việc vừa ở.+ Tầng 1: 3 phòng làm việc + Khu chứa tủ để đồ. + Tầng 2: 1 Phòng khách, 2 phòng ngủ. + Tầng 3: 2 phòng ngủ + 1 phòng thờ. Trên 1 nhà kho chứa đồ. + Toàn bộ Biệt thự và nhà Xưởng xây tường 20 rất kiên cố và chắc chắn, nhà lô góc 2 mặt tiền đường 12m.2/ Tài sản 2: kho xưởng+ Khu đất còn lại là nhà Xưởng 2 tầng toàn bộ bằng sắt, gia Chủ mở rộng kinh doanh về nhà Xưởng to hơn.+ 800m là mặt tiền đường Phan Văn Hớn, ngay chợ Xuân Thới Thượng, Trường Trung học cơ sở Xuân Thới Thượng, Ủy Ban Nhân Dân xã Xuân Thới ...",47 tỷ
22359636,06/11/2023,"Phan Văn Đối, Xã Bà Điểm, Huyện Hóc Môn, TPHCM",1030 m2,1030 m2 (18x60),6,6,Sổ hồng,"Chính chủ gởi, Bán nhà cấp 4 cũ mặt tiền Phan Văn Đối, gần quốc lộ 1A,  cho phép xe lớn đi, không cấm tảiĐịa chỉ: Phan Văn Đối, Xã Bà Điểm, Hóc Môn Diện tích đã lên thổ cư 915m2, ngang 14m, nở hậu 18m, dài 60m2; sẵn nhà và vài kiot.; diện tích thực tế khoảng 1.030m2 Một phần diện tích đấ sẽ được cộng thêm do đường Phan Văn Đối được giảm lộ giới. Nhà chính chủ ở lâu năm khách thiện chí là vào việc ngay. Mặt tiền đắc địa kinh doanh sầm uất. Tiện ích xung quanh đầy đủ.Sổ hồng chính chủ mua bán công chứng nhanh. Gọi ngay để biết thông tin chi tiết P/s: Vì nhiều lý do nên không thể đăng hình thật, anh chị nào quan tâm inbox Lợi gửi hình ảnh anh chị tham khảo.",44 tỷ 500 triệu
22381491,06/11/2023,"Nguyễn Ảnh Thủ, Xã Thới Tam Thôn, Huyện Hóc Môn, TPHCM",320 m2,320 m2 (8x40),6,6,Sổ hồng,"Chính chủ gởi, Bán nhà MT Nguyễn Ảnh Thủ, làm shop quần áo thời trang rất đẹp- Diện tích: 8x40m.- Hiện trạng: Nhà 3 lầu sân thượng.- Vi trí: Nhà nằm trên đoạn đường kinh doanh sầm uất, phù hợp kinh doanh đa ngành nghề, 2 mặt tiền đường lớn thuận tiện di chuyển qua các quận...Gọi ngay cho mình để lấy chìa khoá xem nhà!(Hình minh họa; thực tế là nhà cũ bình thường)",25 tỷ 500 triệu
22367174,06/11/2023,"Đặng Thúc Vịnh, Xã Đông Thạnh, Huyện Hóc Môn, TPHCM",200 m2,200 m2 (20x10),5,6,Sổ hồng,"Chính chủ gởi, Bán nhà mặt tiền kinh doanh Đặng Thúc Vịnh, ngang rộng 20m, đường rộng 6 làn, có vỉa hè.Link video đường Đặng Thúc Vịnh: https://youtu.be/NGROsomsToc?si=dIzvEJFA-nfpUmcJNhà trệt lầu rất đẹp, mặt tiền Đặng Thúc Vịnh, Huyện Hóc Môn.Diện tích ngang 20 mét, nở hậu, dài 10 mét; công nhận hơn 200m2.Kết cấu có thể ở hoặc làm mặt bằng kinh doanh, trụ sở công ty ngay.Vị trí đẹp: Mặt tiền 6 làn đường, ngay UBND xã Đông Thạnh, 10 phút về Q12, giao thông thuận tiện.Tiện ích vô đối : ngay UBND xã Đông Thạnh .Gần chợ Đông Thạnh, Đặng Thúc Vịnh, 10 phút ra chợ Hóc Môn, gần trường học cấp 1-2-3, ngân hàng, cửa hàng siêu thị đầy đủ.Pháp lý : Sổ hồng riêng, pháp lý chuẩn , công chứng ngay Gọi ngay cho Lợi để biết thêm thông tin",22 tỷ 700 triệu
22375447,06/11/2023,"Phan Văn Đối, Xã Bà Điểm, Huyện Hóc Môn, TPHCM",1030 m2,1030 m2 (18x60),6,6,Sổ hồng,"Chính chủ gởi, Bán nhà mặt tiền kinh doanh Phan Văn Đối - Xã bà Điểm, xây trụ sở ngân hàng rất đẹpĐịa chỉ: Phan Văn Đối, Xã Bà Điểm, Hóc Môn Diện tích đã lên thổ cư 915m2, ngang 14m, nở hậu 18m, dài 60m2.; diện tích thực tế khoảng 1.030m2 Một phần diện tích đấ sẽ được cộng thêm do đường Phan Văn Đối được giảm lộ giới. Nhà chính chủ ở lâu năm khách thiện chí là vào việc ngay. Mặt tiền đắc địa kinh doanh sầm uất. Tiện ích xung quanh đầy đủ.Sổ hồng chính chủ mua bán công chứng nhanh. Gọi ngay để biết thông tin chi tiết P/s: Vì nhiều lý do nên không thể đăng hình thật, anh chị nào quan tâm inbox Lợi gửi hình ảnh anh chị tham khảo.",44 tỷ 500 triệu
22375451,06/11/2023,"Phan Văn Đối, Xã Bà Điểm, Huyện Hóc Môn, TPHCM",1030 m2,1030 m2 (18x60),6,6,Sổ hồng,"Chính chủ gởi, Bán nhà mặt tiền kinh doanh Phan Văn Đối - Xã bà ĐiểmĐịa chỉ: Phan Văn Đối, Xã Bà Điểm, Hóc Môn Diện tích đã lên thổ cư 915m2, ngang 14m, nở hậu 18m, dài 60m2.; diện tích thực tế khoảng 1.030m2 Một phần diện tích đấ sẽ được cộng thêm do đường Phan Văn Đối được giảm lộ giới. Nhà chính chủ ở lâu năm khách thiện chí là vào việc ngay. Mặt tiền đắc địa kinh doanh sầm uất. Tiện ích xung quanh đầy đủ.Sổ hồng chính chủ mua bán công chứng nhanh. Gọi ngay để biết thông tin chi tiết P/s: Vì nhiều lý do nên không thể đăng hình thật, anh chị nào quan tâm inbox Lợi gửi hình ảnh anh chị tham khảo.",44 tỷ 500 triệu
22375443,06/11/2023,"Phan Văn Đối, Xã Bà Điểm, Huyện Hóc Môn, TPHCM",1030 m2,1030 m2 (18x60),6,6,Sổ hồng,"Chính chủ gởi, Bán nhà MT Kinh Doanh Phan Văn Đối - làm cửa hàng phân phối thiết bị điện máy rất đẹpĐịa chỉ: Phan Văn Đối, Xã Bà Điểm, Hóc Môn Diện tích đã lên thổ cư 915m2, ngang 14m, nở hậu 18m, dài 60m2.; diện tích thực tế khoảng 1.030m2 Một phần diện tích đấ sẽ được cộng thêm do đường Phan Văn Đối được giảm lộ giới. Nhà chính chủ ở lâu năm khách thiện chí là vào việc ngay. Mặt tiền đắc địa kinh doanh sầm uất. Tiện ích xung quanh đầy đủ.Sổ hồng chính chủ mua bán công chứng nhanh. Gọi ngay để biết thông tin chi tiết P/s: Vì nhiều lý do nên không thể đăng hình thật, anh chị nào quan tâm inbox Lợi gửi hình ảnh anh chị tham khảo.",44 tỷ 500 triệu
