Ma_BDS,Ngay_dang,Dia_chi,Dien_tich_su_dung,Dien_tich_dat,So_phong_ngu,So_nha_tam,Phap_ly,Gioi_thieu,Gia_dat
22692781,03/08/2025,"Tân Sơn Nhì, Phường Tân Sơn Nhì, Quận Tân Phú, TPHCM",800 m2,280 m2 (8x32),8,8,Sổ hồng,"Bán Biệt Thự VIP Mặt tiền đường Tân Sơn Nhì, phường Tân Sơn Nhì, quận Tân Phú+DT: 8x32+DTCN: 280m2+Kết cấu:  1 Hầm, 1 Trệt, 3 Lầu, st+DT sàn: 800m2+NỘI THẤT GỖ CAO CẤP+Giá rẻ 57.9 TỶ+LH: 090.333.7247",57 tỷ 900 triệu
22700399,02/08/2025,"Phú Thọ Hòa, Phường Phú Thọ Hòa, Quận Tân Phú, TPHCM",478 m2,144 m2 (8x18),5,6,Sổ hồng,"🌹 TÒA NHÀ VĂN PHÒNG – CĂN HỘ DỊCH VỤ – GIỮA LÒNG PHÚ THỌ HÒA 🌹💥 Giá chốt chỉ còn: 18 TỶ 500 TRIỆU – Có thương lượng lộc lá 💥Có những căn nhà không chỉ để ở… mà còn để khởi nghiệp – phát triển – và đầu tư sinh lời bền vững.Và đây là một cơ hội như thế:🏢 Tòa nhà 4 tầng (8x18m vuông vức), thiết kế hiện đại, đã có thang máy, sân thượng thoáng mát, giếng trời sau rộng rãi.✨ Đang khai thác văn phòng thuê 40 triệu/tháng – khách thuê ổn định✨ Có thể cải tạo linh hoạt thành hơn 12 căn hộ mini hoặc phòng làm việc riêng biệt📍 Vị trí đắt giá: Chỉ cách mặt tiền 30m, nằm trong khu biệt lập của giới kinh doanh chợ vải – yên tĩnh, văn minh, an ninh🛣️ Giao thông thuận tiện đi Lũy Bán Bích – Bình Long – Âu Cơ – Q.11 – Tân Bình📚 Gần trường học, chợ, siêu thị, và hệ thống tiện ích phong phú📑 Pháp lý chuẩn – sổ hồng riêng chính chủ – Công chứng nhanh trong ngày!👉 Đây là lựa chọn xứng đáng cho người muốn kết hợp vừa ở – vừa đầu tư – vừa kinh doanh ổn định lâu dài.📞 Liên hệ ngay để xem nhà – Cơ hội tốt không chờ đợi ai lâu!",18 tỷ 500 triệu
22697561,02/08/2025,"Bờ Bao Tân Thắng, Phường Sơn Kỳ, Quận Tân Phú, TPHCM",,172 m2 (12x15),5,4,Sổ hồng,"💎 BIỆT THỰ ĐẲNG CẤP NGAY TRUNG TÂM TÂN PHÚ – ĐỐI DIỆN AEON MALL – CELEDON CITY💰 Giá chỉ 26.5 tỷ (thương lượng chính chủ)📐 Diện tích: 172m² (12m × 15m) – vuông đẹp, đúc BTCT 3 tầng🛏️ 5 phòng ngủ – 4 WC, có 1 master, phòng thể thao – thư giãn – phòng thờ – vườn tiểu cảnh – sân thượng cực chill🌳 Hẻm xe tăng, khu toàn biệt thự cao tầng, ngay công viên kế bên☀️ Sân thượng trước và bên hông có đèn năng lượng mặt trời – chiếu sáng rực rỡ ban đêm🏫 Tiện ích xung quanh: Trường Đinh Bộ Lĩnh, Tôn Thất Tùng, Lê Thánh Tông, UBND, chợ Sơn Kỳ, ngân hàng, siêu thị...📲 Liên hệ: 0914 648 319 (Zalo/Call) – Gặp chính chủ, hỗ trợ xem nhà & tư vấn tận tâm!Một căn nhà không chỉ là nơi để ở – mà là nơi bắt đầu những bình yên và hạnh phúc. Hãy để tôi đồng hành cùng anh/chị trên hành trình tìm tổ ấm ấy.Tôi là Nguyễn Quốc Mạnh Tuấn – chuyên môi giới nhà phố, biệt thự đẳng cấp, căn hộ dịch vụ tại:Tân Phú – Tân Bình – Bình TânCam kết thông tin thật – pháp lý rõ ràng – hỗ trợ tận nơiHỗ trợ thương lượng trực tiếp với chính chủLàm việc bằng cái tâm, đồng hành trước – trong – sau giao dịch",26 tỷ 500 triệu
22700524,02/08/2025,"Hoa Bằng, Phường Tân Sơn Nhì, Quận Tân Phú, TPHCM",,"120 m2 (6,7x18)",3,6,Sổ hồng,"🏡 CHẠM VÀO TỔ ẤM MƠ ƯỚC - BIỆT THỰ HOA BẰNG, TÂN PHÚ - NƠI BÌNH YÊN CHỜ BẠN TRỞ VỀ! 🏡Bạn có đang tìm kiếm một không gian sống không chỉ sang trọng, đẳng cấp mà còn là nơi để trái tim thực sự thuộc về? Một nơi mỗi khi về nhà, mọi mệt mỏi đều tan biến, nhường chỗ cho cảm giác an yên và hạnh phúc?Hãy để Tuấn giới thiệu đến bạn một ""tuyệt tác"" như vậy tại con đường Hoa Bằng, khu VIP Tân Sơn Nhì!✨ CẢM NHẬN TỪNG NHỊP ĐẬP CỦA CUỘC SỐNG THƯỢNG LƯU:Ngôi biệt thự bề thế với diện tích 120m² (ngang 6.7m hiếm có), 3 tầng lầu vững chãi, đón trọn ánh sáng và gió trời.Mỗi sớm mai thức dậy trong 3 phòng ngủ rộng rãi, hay cùng gia đình quây quần bên không gian chung ấm cúng.Chủ nhà đã dành trọn tâm huyết, tặng lại toàn bộ nội thất, đặc biệt là bộ nội thất gỗ Hương quý giá, toả hương thơm dịu dàng, mang lại vượng khí cho gia chủ.🌳 NƠI ƯƠM MẦM TƯƠNG LAI:Vị trí vàng, cận kề THPT Tân Phú, Trường Quốc Tế... mở ra môi trường giáo dục hoàn hảo cho con trẻ.Khu dân cư đồng bộ toàn biệt thự, an ninh và văn minh, là nền tảng vững chắc cho một cuộc sống viên mãn.Pháp lý minh bạch, sổ hồng vuông vức đã hoàn công đầy đủ, sẵn sàng trao tay chủ nhân mới.Giá chỉ 15.5 tỷ (còn thương lượng cho khách thiện chí). Một mức giá quá tốt để sở hữu không chỉ một bất động sản, mà là cả một tổ ấm.📞 Đừng bỏ lỡ cơ hội sở hữu chốn đi về tuyệt vời này!Hãy gọi ngay cho Tuấn để cảm nhận trực tiếp vẻ đẹp và năng lượng của ngôi nhà:Tuấn - 0914 648 319Hẹn gặp bạn tại ngôi nhà tương lai của mình!",15 tỷ 500 triệu
22678660,01/08/2025,"Nguyễn Sơn, Phường Phú Thọ Hòa, Quận Tân Phú, TPHCM",,"126 m2 (11x11,5)",6,6,Sổ hồng,"CHÍNH CHỦ BÁN BIỆT THỰ SANG TRỌNG TẠI ĐƯỜNG NGUYỄN SƠN, TÂN PHÚ – LÔ GÓC 2 MẶT TIỀN, NỘI THẤT CAO CẤPCần bán căn biệt thự hiện đại, thiết kế sang trọng, xây dựng kiên cố 4 tầng, tọa lạc tại vị trí đẹp lô góc 2 mặt thoáng ngay trung tâm quận Tân Phú, mặt tiền hẻm đường Nguyễn Sơn. • Diện tích: 126m² (ngang 11m x dài 11.5m) • Kết cấu: 1 trệt 3 lầu, gồm 6 phòng ngủ rộng rãi, không gian sinh hoạt đẳng cấp • Chỗ để ô tô riêng trong nhà, phù hợp gia đình lớn hoặc kết hợp vừa ở vừa kinh doanh • Nội thất cao cấp, chỉ việc xách vali vào ởPháp lý: • Sổ hồng riêng chính chủ, sang tên công chứng nhanh gọn • Pháp lý rõ ràng, minh bạchTiện ích khu vực: • Gần chợ, siêu thị, trường học các cấp, ngân hàng, trung tâm thương mại… • Khu dân cư an ninh, yên tĩnh, dân trí caoGiá bán: 18.5 tỷ (thương lượng cho khách thiện chí)Liên hệ: ......... Gặp chủ thương lượng.Sđt : Tuấn 0948292807",18 tỷ 500 triệu
21851682,30/07/2025,"Đường N1, Phường Sơn Kỳ, Quận Tân Phú, TPHCM",392 m2,130 m2 (5x20),5,6,Hợp đồng mua bán,"CỰC HOT - CHÍNH THỨC NHẬN BOOKING QUỸ CĂN SHOPHOUSE ARTISAN PARK - GAMUDA LANDMột siêu phẩm NHÀ PHỐ THƯƠNG MẠI ngay trung tâm thành phố mới Bình Dương từ Chủ đầu tư Gamuda Land sắp ra mắt.* Tổng quan dự án:- Vị trí xây dựng: Phường Hòa Phú, Thành phố Thủ Dầu Một, Tỉnh Bình Dương.- Nhà đầu tư: Công ty Cổ phần Gamuda Land.- Diện tích quy hoạch: 5,6 ha.- Quy mô sản phẩm: 349 căn nhà phố, shophouse.- Trong đó có 146 căn kết cấu 3 tầng, 223 căn kết cấu 4 tầng.- Diện tích đa dạng cho phép gia chủ tự do lựa chọn với:5m x 17m, 5m x 20m, 6,5m x 17m, 6,5m x 20m.Mỗi căn nhà phố thương mại đều có từ 2 đến 3 mặt tiền đường thoáng mát cùng mảng xanh len lỏi khắp dự án.* Vị trí trung tâm thành phố mới Bình Dương thuộc thành phố Thủ Dầu Một - Bình Dương.- Ngay trung tâm hành chính tỉnh Bình Dương.- Cách vòng xoay World Trade Center .- Có tuyến metro nhà ga kết nối tuyến metro bến thành - suối tiên - Trung tâm thương mại SORA GARDENS SCLiên hệ PKD CĐT: 0907996482 Ms Hiền",9 tỷ 999 triệu
21384844,30/07/2025,"Đường CN1, Phường Sơn Kỳ, Quận Tân Phú, TPHCM","401,3 m2",80 m2 (5x16),6,7,Giấy tờ hợp lệ,"Giỏ hàng MUA trực tiếp từ chủ đầu tư Condo Villa - The Glen@The Brilliant giá siêu tốt trong rổ hàng đợt cuối.- Chiết khấu 10%- Chiết khấu bàn giao thô: 15%-  Nhà mới 100% có sẵn, dọn vào ở ngay, đa dạng lịch thanh thanh toán:1. Thanh toán 20% nhận nhà, trả góp 6 tháng/ 10% trong vòng 3 năm không lãi suất2. Hỗ trợ ân hạn hạn gốc và lãi 7%/ năm trong vòng 2 năm3.Nhận chiết khấu full khi thanh toán 95%+ Tổng diện tích sử dụng từ 300m2 lên đến 500m2.+ Đặc biệt: Chỉ có 98 căn duy nhất tại #Celadon City, nằm ngay vị trí vàng của dự án, đều có view hướng ra công viên trung tâm 16ha cây xanh hiện hữu.+ Hầm xe: Có thể đỗ được 2 oto, 1 phòng đa năng.+ Tầng trệt - tầng 1: 1 phòng khách, 1 phòng bếp, 1 phòng ngủ và khu sinh hoạt chung cho gia đình.+ Tầng 2: 2 phòng ngủ(1 phòng master bedroom) cùng với khu sinh hoạt chung.+ Tầng 3: 2 phòng ngủ(1 phòng master bedroom).+ Tầng 4: Sân thượng, khu sinh hoạt chung, sân phơi, phòng thờ.* Tất cả các phòng đều có ban công kính, và hệ số view thoáng rộng. Cửa trượt kết hợp với ban công kính ở từng tầng tạo nên không gian mở đón ánh sáng tự nhiên và sinh khí tràn vào.+ Điểm nổi bật thiết kế: Thang máy kính trong suốt từ hầm lên đến tất cả các tầng.* Tiến độ thanh toán nhẹ nhàng duy nhất tại Celadon City.",21 tỷ
21385245,30/07/2025,"Đường CN1, Phường Sơn Kỳ, Quận Tân Phú, TPHCM",440 m2,96 m2 (6x16),6,7,Giấy tờ hợp lệ,"Condo Villa - The Glen. Căn góc chênh hấp dẫn+ Tổng diện tích tim tường 440 m2 - Thông thủy: 383.7m2Giá HĐ: 31,8 Tỷ  (102% + VAT)+ Hầm xe: Có thể đỗ được 2 oto, 1 phòng đa năng+ Tầng trệt - tầng 1: 1 phòng khách, 1 phòng bếp, 1 phòng ngủ và khu sinh hoạt chung cho gia đình+ Tầng 2: 2 phòng ngủ(1 phòng master bedroom) cùng với khu sinh hoạt chung+ Tầng 3: 2 phòng ngủ(1 phòng master bedroom)+ Tầng 4: Sân thượng, khu sinh hoạt chung, sân phơi, phòng thờ* Tất cả các phòng đều có ban công kính, và hệ số view thoáng rộng. Cửa trượt kết hợp với ban công kính ở từng tầng tạo nên không gian mở đón ánh sáng tự nhiên và sinh khí tràn vào.+ Đặc biệt: Chỉ có 98 căn duy nhất tại Celadon City, nằm ngay vị trí vàng của dự án, đều có view hướng ra công viên trung tâm 16ha cây xanh hiện hữu.+ Cảnh quan cây xanh nội khu đa dạng sinh thái.+ Mật độ không gian sống rộng nhất toàn thành phố 18m2/người.Tiến độ thanh toán nhẹ nhàng- Ký HĐMB chỉ 5%. đóng đủ 20% đến khi nhận nhàLH: 0907996482",31 tỷ 800 triệu
22444528,26/06/2025,"Đô Đốc Lộc, Phường Tân Quý, Quận Tân Phú, TPHCM",1280 m2,"325 m2 (6,7x43)",8,8,Sổ hồng,"BIỆT THỰ 2 MẶT TIỀN KINH DOANH - 325M2 ĐẤT - 4 TẦNG HOÀNH TRÁNG -  SỔ NỞ HẬU PHONG THUỶ CỰC TỐT.Biệt thự mặt tiền Đô Đốc Lộc phường Tân Quý Quận Tân PhúMô tả:- Diện tích nhà: 325m2, ngang 6.7m dài 43m nở hậu hơn 11m. Công nhận đủ- Nhà chia thành 2 căn: +  Căn biệt thự ở phía trước 6.6 x19m. Gồm 6 phòng ngủ + 7 tolet + sân thượng + phòng thờ + Hồ bơi+ Phần diện tích còn lại 6.6m dài 24m kinh doanh sản xuất, có hẻm phía sau thông ra mặt tiền Tân Quý. + Thích hợp khách vừa ở vừa kinh doanh sản xuất tại nhà. + Sổ Hồng, pháp lý sạch, công chứng mua bán được ngay- Giá chỉ 31 tỷ, thương lượng thêm với khách mua thiện chí.Mua bán nhà chính chủ Tân Phú. Liên hệ ngay để được tư vấn, xem nhà 24/24 miễn phí. Cam kết đàm phán giao dịch chính chủ, hỗ trợ giá tốt nhất (Miễn trung gian)@STTP-86 - NHADATST - NHÀ THẬT GIÁ THẬT - TÌM VỚI ST, MUA NHÀ THẬT DỄ",31 tỷ
22679854,26/05/2025,"Bờ Bao Tân Thắng, Phường Sơn Kỳ, Quận Tân Phú, TPHCM",,172 m2 (12x15),5,5,Sổ hồng,"BIỆT THỰ SIÊU PHẨM NGAY TRUNG TÂM TÂN PHÚ – ĐỐI DIỆN AEON – KHU CELEDONDiện tích khủng – Vị trí vàng – Thiết kế lộng lẫy – Giá tốt	•	Diện tích: 12 x 15m = 172m² – Biệt thự 3 tầng đổ BTCT	•	Kết cấu: 5PN – 4WC (1 Master), phòng gym, phòng thư giãn, phòng thờ	•	Sân vườn cực chill, vườn thượng uyển, tiểu cảnh, đèn NLMT ban đêm tỏa sáng	•	Sân thượng trước & hông – gió mát cả ngàyVị trí VIP:	•	Đối diện AEON Tân Phú, sát công viên, khu biệt thự Celadon City	•	Hẻm xe tải, khu nhà cao tầng sang trọng, dân trí cao	•	Xung quanh tiện ích đầy đủ: gần trường học các cấp, UBND, chợ Sơn Kỳ, ngân hàng…Pháp lý sạch – sẵn sàng công chứngGiá chỉ: 26 tỷ 500 triệu – Biệt thự trung tâm cực hiếmLiên hệ em Hải : 0944903123",26 tỷ 500 triệu
22639967,17/05/2025,"Trịnh Đình Trọng, Phường Hòa Thạnh, Quận Tân Phú, TPHCM",350 m2,200 m2 (9x22),4,4,Sổ hồng,"Ngộp, cần bán gấp nhà hẻm thông ô Tô Trịnh đình trọng, Hòa Thạnh, Tân Phú+ Diện tích : 9,5x21, Kết cấu 1 trệt 1 lầu,+ Giá bán 12,5 tỷ thương lượng mạnh+ Phù hợp xây biệt thự, nhà vườn, công ty, căn hộ kinh doanh,….+ Pháp lí minh bạch,công chứng ngay cách 20m ra mặt tiền đường chính,+ Liền kề các tuyến đường, Trịnh Đình Trọng, Trịnh Đình Thảo, Kênh Tân Hóa, Lũy Bán Bích, Thạch lamLH : 0903619667Xin cám ơn",12 tỷ 800 triệu
22412732,04/09/2024,"Nguyễn Súy, Phường Tân Quý, Quận Tân Phú, TPHCM",565 m2,"141 m2 (5,6x26)",9,10,Sổ hồng,"- Biệt Thự Kiểu Pháp- Mặt Tiền Đường Nội Bộ 14m- TÂN HƯƠNG- NGUYỄN SUÝ- 141m2(5.6x26)- 6Tầng- P.Tân Quý- Q.Tân Phú- Có Thang Máy- DT: 5.55m x 26m, vuông vức, Cn 140,5m2, DTS 564,5m2. - Kết cấu : 1 trệt, 4 lầu, sân thượng, gồm Phòng Khách, Bếp, 9 Phòng, 10 WC, nội thất cao cấp nhập khẩu.- Vị trí đẹp : gần trục đường lớn Tân Hương - Tân Quý, gần chợ Tân Hương, cách siêu thị AEON 500m- Sổ hồng chính chủ, không lỗi phong thủy, hoàn công đủ, công chứng ngay.- Giá bán: 17 Tỷ TL- Liên Hệ : NHỚ 0909234278 Để xem nhà",17 tỷ
21966341,04/09/2024,"Chế Lan Viên, Phường Tây Thạnh, Quận Tân Phú, TPHCM",264 m2,128 m2 (6x19),4,4,Sổ hồng,"-  ĐỊNH CƯ ! BÁN GẤP BIỆT THỰ VIP- HẺM 10M CÓ LỀ ĐƯỜNG RỘNG 2.5m- CHẾ LAN VIÊN- Q.TÂN PHÚ- 128M2(6x19, NỞ HẬU 7.5m)- XE HƠI 7 CHỖ NGỦ TRONG NHÀ - NHÀ ĐẸP Ở NGAY- Kết cấu: 1 Trệt, 1 lầu, Sân Thượng với 4PN, 4WC.- Vị trí: Đẹp gần BigC - Pandora, Đại học CNTP, Hồ Bơi, Công Viên, đường Tây Thạnh, đường Trường Chinh, khu công nghiệp Tân Bình, ...- Khu an ninh yên tĩnh, giao thông đi lại thuận tiện, hẻm thông thoáng sạch sẽ phù hợp ở và buôn bán mọi ngành nghề.- Sổ cực đẹp, Nở Hậu tài lộc, pháp lý chuẩn.- Gía 12.7 Tỷ TL - Liên Hệ : THU NHỚ 0909234278",12 tỷ 700 triệu
22608088,04/09/2024,"Nguyễn Cửu Đàm, Phường Tân Sơn Nhì, Quận Tân Phú, TPHCM",,68 m2 (4x17),3,4,Sổ đỏ,"BÁN 2 MTKD - NGAY TÂN SƠN NHÌ, NGUYỄN CỬU ĐÀM - TRUNG TÂM TÂN PHÚ - DTXD>68M2 - 3 TẦNG - CHỈ 9,2T+ Vị trí: 2 MTKD hẻm nhựa (1 mặt hẻm 8m), thuộc khu VIP Tân Sơn Nhì, ngay Nguyễn Cửu Đàm, gần công viên, gần chợ,…+ Diện tích: 4x17,1m - Xây dựng 68,4m2+ Kết cấu: 3 tầng BTCT gồm 3PN cùng đẩy đủ công năng sống.————————————————————————        🏢 NHÀ PHỐ HCM 🏦     Mr.Tuấn Anh              📲0903286078 - 0989563438                  ———————————————📑 Hỗ trợ TƯ VẤN PHÁP LÝ BĐS Nhà Phố FREE.📝 Hỗ trợ MUA-BÁN BĐS Nhà Phố chính chủ.💁🏻‍♂️ TIẾP NHẬN-CUNG ỨNG nhà theo nhu cầu.🙅‍♂️ Nói KHÔNG với Nhà Pháp lý chưa rõ ràng.                  ———————————————          TẬN TÂM - UY TÍN - CHUYÊN NGHIỆP",9 tỷ 200 triệu
22600676,04/09/2024,"Lũy Bán Bích, Phường Phú Thạnh, Quận Tân Phú, TPHCM",,130 m2 (6x22),10,10,Sổ đỏ,"CHỈ 90tr/m2 - HXH TRÁNH THÔNG TỨ TUNG - SÁT TÂN BÌNH - 130M2 - NGANG 6M VUÔNG - DÃY TRỌ C4 - GIÁ 11,8T✅ Hiện trạng: Nhà C4 đang là dãy phòng trọ. Thu nhập gần 50 tr/th✅ Vị trí: HXH 8M một trục, thông tứ tung. Gần sát Tân Bình, giáp Q6, Q11. Khu phân lô cao tầng, dân trí cao, hàng xóm hiền lành. ✅ Diện tích: 130m2, ngang 6 dài 22m vuông vức. Phù hợp xây mới dạng BT để ở hoặc làm CHDV cực tốt.-----------------------------------------------        🏢 NHÀ PHỐ HCM 🏦     Mr.Tuấn Anh              📲0903286078 - 0989563438                     --------------------------📑 Hỗ trợ TƯ VẤN PHÁP LÝ BĐS Nhà Phố FREE.📝 Hỗ trợ MUA-BÁN BĐS Nhà Phố chính chủ.💁🏻‍♂️ TIẾP NHẬN-CUNG ỨNG nhà theo nhu cầu.🙅‍♂️ Nói KHÔNG với Nhà Pháp lý chưa rõ ràng.                     --------------------------          TẬN TÂM - UY TÍN - CHUYÊN NGHIỆP",11 tỷ 800 triệu
22590373,04/09/2024,"Bờ Bao Tân Thắng, Phường Sơn Kỳ, Quận Tân Phú, TPHCM",,"185 m2 (10x18,5)",6,7,Sổ đỏ,"TÒA NHÀ ĐA CHỨC NĂNG, KD ĐA NGÀNH - NGAY AEON MALL - HẺM NHƯ ĐƯỜNG - NGANG 10 - 185M2 - 6 TẦNG- Kết cấu: trệt, lửng, 3 Lầu, Sân Thượng, Thang máy, Cầu thang bộ, …- Hiện trạng: trệt thông sàn, lửng thông sàn hiện tại đang trưng bày sản phẩm, tầng 2-3-4 làm VP, tầng thượng làm phòng ăn.- Hẻm nhựa 8m, ngay Aeon Mall, Celadon City, cách 50M ra đường Tân Thắng...GIÁ 25T-----------------------------------------------        🏢 NHÀ PHỐ HCM 🏦     Mr.Tuấn Anh              📲0903286078 - 0989563438                     --------------------------📑 Hỗ trợ TƯ VẤN PHÁP LÝ BĐS Nhà Phố FREE.📝 Hỗ trợ MUA-BÁN BĐS Nhà Phố chính chủ.💁🏻‍♂️ TIẾP NHẬN-CUNG ỨNG nhà theo nhu cầu.🙅‍♂️ Nói KHÔNG với Nhà Pháp lý chưa rõ ràng.                     --------------------------          TẬN TÂM - UY TÍN - CHUYÊN NGHIỆP",25 tỷ
22588715,04/09/2024,"Vườn Lài, Phường Phú Thọ Hòa, Quận Tân Phú, TPHCM",118 m2,"106 m2 (5,5x21,4)",6,5,Sổ đỏ,"NGỘP - MTKD ĐƯỜNG VƯỜN LÀI - ĐOẠN KINH DOANH ĐẸP NHẤT - NGANG 5,5M - 106M2 - 3 TẦNG THÔ - NHỈNH 15T- Diện tích: 5,5x21,4m (106.2m2); Diện tích thực tế: 118m2.- Hiện trạng: 3 tầng BTCT chắc chắn có 6PN bàn giao nhà thô (chủ ngộp hết tiền hoàn thiện), thuận tiện hoàn thiện, sửa đổi nội thất theo nhu cầu.- Vị trí: MT đường Vườn Lài, gần ngã 3 với Phan Đình Phùng, đoạn kinh doanh đỉnh cao của cả cung đường Vườn Lài nổi tiếng- Bank cho vay 16T (khách tự đánh giá nhé)-----------------------------------------------        🏢 NHÀ PHỐ HCM 🏦     Mr.Tuấn Anh              📲0903286078 - 0989563438                     --------------------------📑 Hỗ trợ TƯ VẤN PHÁP LÝ BĐS Nhà Phố FREE.📝 Hỗ trợ MUA-BÁN BĐS Nhà Phố chính chủ.💁🏻‍♂️ TIẾP NHẬN-CUNG ỨNG nhà theo nhu cầu.🙅‍♂️ Nói KHÔNG với Nhà Pháp lý chưa rõ ràng.                     --------------------------          TẬN TÂM - UY TÍN - CHUYÊN NGHIỆP",15 tỷ 800 triệu
22582360,04/09/2024,"Tân Sơn Nhì, Phường Tân Sơn Nhì, Quận Tân Phú, TPHCM",,80 m2 (4x20),4,5,Giấy tờ hợp lệ,"MẶT TIỀN KINH DOANH TÂN SƠN NHÌ - KHU VIP BẬC 1 TÂN PHÚ - 3 TẦNG - 80M2 VUÔNG - CHỈ 17T📲 #0903286078 #0989563438 #TuấnAnh- Mặt tiền kinh doanh khu sầm uất Tân Sơn Nhì, nơi phát triển đa ngành nghề, vip bậc 1 Tân Phú.- Nhà 3 tầng có 4PN đang cho thuê, phù hợp vừa ở vừa KD hoặc làm VP.",17 tỷ
22620763,04/09/2024,"Phú Thọ Hoà, Phường Phú Thọ Hòa, Quận Tân Phú, TPHCM",,80 m2 (6x15),4,5,Sổ đỏ,"NGAY TT CHỢ VẢI PTHOÀ, GIAO THƯƠNG SẦM UẤT - HXH TRÁNH - NGANG BỰ 6M - 80M2 - 5 TẦNG - CHỈ NHÍCH 10T- Diện tích: 80m2 có ngang bự tới 6m.- Kết cấu: TK xây dựng 5 tầng có lửng gồm tầng trệt thông suốt, để 2 chiếc xe tải thoải mái, 4PN cùng đầy đủ công năng sống.- Hẻm 6m sạch sẽ, dân trí cao, hàng xóm thiện lành.- Vị trí: ngay trung tâm chợ vải Tân Phú, gần Vườn Lài , Lê Văn Phan,.. gần UBND quận, 5 phút qua Bàu Cát, Q6, Q11, BT,…————————————————————————        🏢 NHÀ PHỐ HCM 🏦     Mr.Tuấn Anh              📲0903286078 - 0989563438                  ———————————————📑 Hỗ trợ TƯ VẤN PHÁP LÝ BĐS Nhà Phố FREE.📝 Hỗ trợ MUA-BÁN BĐS Nhà Phố chính chủ.💁🏻‍♂️ TIẾP NHẬN-CUNG ỨNG nhà theo nhu cầu.🙅‍♂️ Nói KHÔNG với Nhà Pháp lý chưa rõ ràng.                  ———————————————          TẬN TÂM - UY TÍN - CHUYÊN NGHIỆP",10 tỷ 700 triệu
22614998,04/09/2024,"Đường CN1, Phường Sơn Kỳ, Quận Tân Phú, TPHCM",,"104 m2 (4,5x23)",2,2,Sổ đỏ,"MTKD KHU PHÂN LÔ - SÁT CĂN GÓC - GẦN CELADON - NGANG 4,5M - HƠN 100M2 - 2 TẦNG - NHÍCH 10T- Diện tích: ngang 4,5m vuông vức, hơn 100m2, không lộ giới. Vỉa hè sạch sẽ, thoáng.- Kết cấu: nhà C4 có lửng gồm 2PN và MB kinh doanh. Nhà còn mới có thể vào ở ngay hoặc xây dựng mới tùy thích.- Vị trí: Khu phân lô đồng bộ toàn nhà cao tầng, sát lô góc, gần công viên, Celadon, Aeon Mall, đường xá cực sầm uất kinh doanh cực tốt.————————————————————————        🏢 NHÀ PHỐ HCM 🏦     Mr.Tuấn Anh              📲0903286078 - 0989563438                  ———————————————📑 Hỗ trợ TƯ VẤN PHÁP LÝ BĐS Nhà Phố FREE.📝 Hỗ trợ MUA-BÁN BĐS Nhà Phố chính chủ.💁🏻‍♂️ TIẾP NHẬN-CUNG ỨNG nhà theo nhu cầu.🙅‍♂️ Nói KHÔNG với Nhà Pháp lý chưa rõ ràng.                  ———————————————          TẬN TÂM - UY TÍN - CHUYÊN NGHIỆP",10 tỷ 500 triệu
22609651,04/09/2024,"Phú Thọ Hoà, Phường Phú Thọ Hòa, Quận Tân Phú, TPHCM",,"101 m2 (4,5x22)",4,6,Sổ đỏ,"NHÀ 5 TẦNG MỚI ĐẸP - HẺM XE HƠI TRÁNH, SÁT MẶT TIỀN - NGAY PHÚ THỌ HOÀ, GẦN UBND QUẬN - GIÁ 14,8T- Diện tích: 4,5x22m nở hậu 4,7m - 101,2m2- Ngay nhà xe hơi tránh đổ bê tông sạch sẽ, cách mặt tiền chỉ 20m. Nhà xây chuẩn lộ giới, chừa sân trước và sân sau chuẩn xây dựng, hoàn công đủ hết tầng- Kết cấu 5 tầng BTCT, có 6PN, 6WC, phòng bếp, khách, phòng thờ, sân thượng trước sau, thiết kế giếng trời lấy sáng nhà và thoáng mát.————————————————————————        🏢 NHÀ PHỐ HCM 🏦     Mr.Tuấn Anh              📲0903286078 - 0989563438                  ———————————————📑 Hỗ trợ TƯ VẤN PHÁP LÝ BĐS Nhà Phố FREE.📝 Hỗ trợ MUA-BÁN BĐS Nhà Phố chính chủ.💁🏻‍♂️ TIẾP NHẬN-CUNG ỨNG nhà theo nhu cầu.🙅‍♂️ Nói KHÔNG với Nhà Pháp lý chưa rõ ràng.                  ——————————————          TẬN TÂM - UY TÍN - CHUYÊN NGHIỆP",14 tỷ 800 triệu
