Ma_BDS,Ngay_dang,Dia_chi,Dien_tich_su_dung,Dien_tich_dat,So_phong_ngu,So_nha_tam,Phap_ly,Gioi_thieu,Gia_dat
22564730,23/05/2024,"Âu Cơ, Phường Phú Trung, Quận Tân Phú, TPHCM",110 m2,40 m2 (3x14),3,3,Sổ hồng,"NHÀ MỚI ĐẸP TÂN PHÚ GIÁP TÂN BÌNH, GẦN LẠC LONG QUÂN - ÂU CƠ, 40 M2, 3 TẦNG, 3PN, HOÀN CÔNG ĐỦ, TẶNG NỘI THẤT mới tinh 100%.+ Vị trí tuyệt đẹp cạnh mặt tiền trung tâm Tân Phú  giáp Tân Bình, Quận 11, gần Ngã Tư Lạc Long Quân - Âu Cơ.+ Hiện trạng 2 lầu có sân thượng, gồm phòng khách, bếp, tổng 3PN ( có thể thiết kế thêm 1 PN nữa), 3WC, mới xây kiên cố chắc, khách mua dọn vào ở được ngay. + Tiện ích bủa vây đầy đủ xung quanh gần như không thiếu thứ gì. Đi vào các Quận trung tâm cũng rất thuận tiện.+ Hẻm thông khắp nơi, ba gác quay đầu thoải mái.+ Sổ hồng chính chủ, vuông đẹp tại gia, sang tên công chứng ngay khi khách thích.",4 tỷ 150 triệu
22564702,23/05/2024,"Sơn Kỳ, Phường Sơn Kỳ, Quận Tân Phú, TPHCM",120 m2,64 m2 (4x16),2,2,Sổ hồng,"● Bán nhà P. Sơn Kỳ, Tân  Phú gần Lê Trọng Tấn , gần chọ Sơn Kỳ .+ Dt 4 x 16 =64m2 , 2 tầng, 2 PN .+ Hẻm 5m gần mặt tiền , xe hơi vào nhà vô tư.+ Sổ hồng , hoàn công đầy đủ +",4 tỷ 900 triệu
22562645,20/05/2024,"Trần Văn Ơn, Phường Tân Sơn Nhì, Quận Tân Phú, TPHCM",150 m2,"50 m2 (4x12,5)",4,3,Sổ hồng,"+ Bán nhà dường Trần Văn Ơn P.Tân Sơn nhì Tân Phú .+ Nhà gần trường học các cấp 1, 2, 3 - Đoàn Thị Điểm , trường Tân Bình ...+ Gần Chợ ,thuận tiện nhiều tiện ích  Mô tả:- Nhà xd 1 trệt 2 lầu,  sân thượng.- 4 phòng ngủ, 3 vệ sinh.- Hẻm 3,5 m thẳng sạch, cách mặt tiền 20m.+ Khu an ninh , văn minh.+ Sổ hồng pháp lý, hoàn công đầy đủ ,",4 tỷ 700 triệu
22561563,18/05/2024,"Bờ Bao Tân Thắng, Phường Sơn Kỳ, Quận Tân Phú, TPHCM",220 m2,"55 m2 (5,7x10)",4,4,Sổ hồng,"XE TẢI VÀO NHÀ - CÁCH MẶT TIỀN 30m - 5 TẦNG BTCT - THIẾT KẾ NHƯ BIỆT THỰ MINI - 3 MẶT THOÁNG - NGANG GẦN 6m VUÔNG A4 - CHỈ 6.4 tỷ TLMô tả: 👉 Diện tích: 55m2 ( 5.7m x 9.2m) Vuông vức. 👉 Kết cấu: 1 trệt + 3 lầu + Sân thượng, 4PN + 4WC. 👉 Hẻm 7m, xe tải vào nhà. Cách mặt tiền vài bước chân. 👉 Chủ tặng nội thật xịn. 👉 Nhà thiết kế hiện đại, full công năng tầng trệt .● Tiện làm VP , chỗ để xe hơi thoải mái 👉 Pháp lý chuẩn,hoàn công đủ,  công chứng ngay.",6 tỷ 500 triệu
22556222,11/05/2024,"Hòa Bình, Phường Tân Thới Hòa, Quận Tân Phú, TPHCM",100 m2,52 m2 (4x13),2,2,Sổ hồng,"Mô tả chi tiết🔔 SIÊU PHẨM Q Tân Phú- NHÀ ĐẸP KIẾN TRÚC CHÂU ÂU - TẶNG FULL NỘI THẤT🔔 👉 5.3 tỷ🔔 Luỹ Bán Bích Kế Đầm Sen - 52m2- 2 Tầng - Hẻm Xe Hơi - Nội Thất LuXuRy.=====================🎯Mô tả:👉 Nhà đẹp 2 tầng BTCT: 51m2(4x13), 2 tầng 2PN, 2WC, Ban Công, quầy bar, nội thất xịn sò.👉 Đường Hẻm Ô Tô nhỏ tới nhà, hẻm thông ;🎯 Kế Đầm Sen, Ngã Tư Hoà Bình, Lũy Bán Bích",5 tỷ 300 triệu
22556232,11/05/2024,"Nguyễn Sơn, Phường Phú Thạnh, Quận Tân Phú, TPHCM",200 m2,80 m2 (4x20),5,5,Sổ hồng,"HẺM 8 MÉT 1 TRỤC GẦN MẶT TIỀN, XE HƠI NGỦ TRONG NHÀ, GIÁ CỰC KỲ Mô tả: + Vị trí trung tâm Tân Phú, Nguyễn Sơn, Thạch Lam, Lũy Bán Bích.+ Hẻm 8 mét, xe hơi ngủ trong nhà.+ Kết cấu 3 tầng sân thượng, 5 phòng ngủ, có phòng ngủ dưới tầng trệt.+ Sổ vuông vắn, không lộ giới, không quy hoạch. Nhà còn mới dọn vào ở ngay.+ Giá cực kỳ tốt trong khu vực.",7 tỷ 850 triệu
22555091,10/05/2024,"Đường N1, Phường Sơn Kỳ, Quận Tân Phú, TPHCM",367 m2,112 m2 (7x16),5,6,Hợp đồng mua bán,"* Biệt thự sở hữu tiện ích đẳng cấp 5 sao ngay phân khu Diamond Briliant thuộc KĐT Quốc Tế Celadon City, với công viên 16hecta bao bọc, cùng vô vàn tiện ích đẳng cấp quốc tế.- Chỉ 98 căn CondoVilla toạ lạc tại quỹ đất 5.5 hecta, - Đặc quyền sử dụng Clubhouse 5* nội khu- Tiện ích đẳng cấp vượt trội: Hồ bơi tràn, nhà hàng 5*, Gym, Phòng xông hơi, BBQ ngoài trời, chòi nghỉ chân,... - Với 18m² cây xanh trên 1 người, mật độ xanh khó tìm tại trung tâm Sài Gòn, đây được xem là mảnh ghép sức khoẻ hoàn hảo- Được sống trong một cộng đồng đẳng cấp, an ninh- Thiết kế 1 hầm, 1 trệt và 4 lầu- Diện tích đất 5x16 - 7x16- Tổng diện tích sử dụng 344m² - 473m2- Nhận nhà ở liền, mua giá gốc trực tiếp CĐT Gamuda, tiến độ thanh toán dãn và có nhiều ưu đãi tốt:- Chỉ TT 17% nhận nhà, phần còn lại TT dãn dài trong 2 năm 0% lãi suất- Hoặc TT 20-30% nhận nhà, phần còn lại ngân hàng giải ngân ân hạn gốc lãi 2 năm.Liên hệ Em Thuận 0933 149 558 hỗ trợ xem nhà chọn hướng, tư vấn đầy đủ các chính sách ưu đãi tốt nhất từ CĐT",25 tỷ
22554721,09/05/2024,"Gò Dầu, Phường Tân Quý, Quận Tân Phú, TPHCM",150 m2,"56 m2 (4,6x12)",3,3,Sổ hồng,"GẦN NGAY AEON TÂN PHÚ, CÁCH HẺM ÔTÔ 5M, LÔ GÓC KHÔNG Looj giới ,SÁT MẶT TIỀN, 56M2 NGANG GẦN 5M, 3 TẦNG BTCT, 3PN, SỔ A4 HOÀN CÔNG ĐỦ, CHÀO CHỈ 4.6 TỶ. Mô tả:+ Vị trí tuyệt đẹp trung tâm Tân Phú, gần trung tâm thương mại Aeon Mall Tân Phú, chợ Tân Hương, nơi hội tụ mọi tiện ích bủa vây xung quanh.+ Nhà 3 tầng đúc thật... gồm phòng khách, bếp ,tổng 3PN 3WC. Có sân rộng trước nhà để được gần 10 xe máy .Khu vực an ninh, yên tĩnh dân trí cao...+ Pháp lý chuẩn, sổ  tại gia vuông như tờ A4 cực đẹp, hoàn công đủ, mua bán nhanh trong ngày.",4 tỷ 500 triệu
22554744,09/05/2024,"Nguyễn Cửu Đàm, Phường Tân Sơn Nhì, Quận Tân Phú, TPHCM",120 m2,60 m2 (4x15),2,2,Sổ hồng,"@ Chủ ngộp thở cấp 8 rồi , @ Nhà cách đường xe tải chỉ 1 căn nhà , vị trí 2 mặt thoáng hẻm 3m.@ Dt 4 x 15 = 60m2 , 2 tầng , kg lộ giới .@ Giá chỉ 4 tỷ 150 triệu / 60m2  còn TL@ Giá tốt hơn thị trường rất nhiều , chủ xác định bán đất tặng nhà",4 tỷ 150 triệu
22537576,07/05/2024,"Nguyễn Sơn, Phường Phú Thạnh, Quận Tân Phú, TPHCM",,"72 m2 (4,5x17)",6,6,Sổ hồng,"Bán nhà phố liền kề ngay tại trung tâm Quận Tân Phú TpHCMVị trí : Đường Nguyễn Sơn , Phường Phú Thạnh , Quận Tân Phú, TpHCMKhu Nhà Phố liền kề đẹp chỉnh chu ngay Trung Tâm Quận Tân PhúTiện ích xung quanh : Siêu thị Big C - Chợ - Trường Học - UBND Quận Kết nối giao thông Thuận tiện : trên trục đường chính nguyễn sơn con đường huyết mạch nối giửa các quận TpHCMDiện tích : 4,2m x18mKết cấu : 1 trệt + 3 lầuHiện trạng : Nhà hoàn thiện nội thất cao cấp - thiết bị nhậpGiá bán : 16,5 tỷ Pháp lý sổ hồngLiên hệ: 0937 372086",16 tỷ 500 triệu
22551327,05/05/2024,"Âu Cơ, Phường Phú Trung, Quận Tân Phú, TPHCM",160 m2,"80 m2 (4,6x17)",4,3,Sổ hồng,"+Vị trí nhà HXH  rất thuận tiện kinh doanh buôn bán .● Dt lớn : 4,6 x 17 , 2 tầng 4 PN .● Khu dân cư đông đúc ,buôn bán gì cũng được , xe tải đậu cửa vô tư● Gần Lạc Long Quân , Trần văn Quang , Q11.● Nhiều tiện ích xung quanh.",8 tỷ 200 triệu
22439904,30/03/2024,"Tân Sơn Nhì, Phường Tân Sơn Nhì, Quận Tân Phú, TPHCM",,66 m2 (4x17),4,4,Sổ hồng,BÁN NHÀ CHIA TÀI SẢN - CHÍNH CHỦ LÂU ĐỜI - HXH - 66M2(4x17)  - 4 TẦNG - 3PN - 2 SÂN THƯỢNG - 2 PHÒNG TRỌ (5tr/th) CHỈ 6tỷ xxx.Mô tả: - Nhà chính chủ lâu đời tự xây dựng tâm huyết 4 tầng BTCT: 3PN; 2 sân thượng;   - Tầng 1: phòng để xe; 2 phòng trọ phía sau cho thuê đi cửa bên hông.  - Các tầng trên sinh hoạt gia đình đầy đủ. - Hẻm xe hơi / ra Âu Cơ; khu dân trí cao; trước nhà có sân to đáp được xe tăng;- Vị trí khu vực hiếm nhà bán Tân Sơn Nhì; Kế bên Khu vip Bàu Cát - Tân Bình;liên hệ a dương xem nhà,6 tỷ 890 triệu
22499122,29/03/2024,"Thoại Ngọc Hầu, Phường Phú Thạnh, Quận Tân Phú, TPHCM",,75 m2 (5x15),6,6,Không xác định,"5 TẦNG BTCT - NGANG 5x15 THANG MÁY HXH TRƯỚC NHÀ 8M  - TÂN PHÚ GIÁP TÂN BÌNH - NHÀ ĐEP SÁT MẶT TIỀN.- Hiếm Ngay cung đường vip đáng sống, Thoại ngọc hầu tân phú, -Nhà đẹp dọn vào ở ngay, nội thất xịn , Chi phí xây dựng đã hơn 3 Tỷ.- Kết cấu 1 trệt 3 lầu sân thượng. Gồm 6PN, 6WC, bếp, phòng khách, sân rộng, ban công … OTO NGỦ TRONG NHÀ. - Vị trí siêu đẹp, trong khu phân lô cao cấp, dân trí cao, an ninh, hẻm xe hơi, sát mặt tiền, chợ, siêu thị....tiện ích xung quanh không thiếu gì.Xe hơi ra vào thoải mái, Sát công viên thoáng mát. Liên hệ A dương xem nhà",10 tỷ 890 triệu
22451119,16/01/2024,"Lê Cao Lãng, Phường Phú Thạnh, Quận Tân Phú, TPHCM",300 m2,97 m2 (8x13),8,7,Sổ hồng,"- Vị trí: Góc mặt tiền phường Phú Thạnh, quận Tân Phú, TP. HCM- Vị trí rất đẹp, góc 2 mặt tiền kinh doanh. - Biệt thự cực đẹp, vào là mê bởi lối thiết kế theo phong cách hiện đại của những nội thất cao cấp Châu Âu kết hợp cổ kính của đồ gỗ gõ quý giá. Kết cấu 1 trệt 1 lửng 2 lầu sân thượng trước sau. 5 phòng ngủ rộng và 1 phòng thờ, tầng trệt cho thuê spa và để xe 7 chỗ.- Nội 9 tỷ mới Tặng tất cả nội thất cao cấp ngoại nhập từ Châu Âu và toàn đồ gỗ quý gõ đỏ.- Pháp lý chuẩn, sổ riêng vuông vức vạc góc- Diện tích 8 x 13 - Giá 17,95 tỷ thương lượng=> LH: 077 549 5849 hoặc Zalo số 0934058039 để xem nhà",17 tỷ 950 triệu
22445690,16/01/2024,"Tân Quý, Phường Tân Quý, Quận Tân Phú, TPHCM",80 m2,49 m2 (4x12),2,2,Sổ hồng,"-Vị trí: 1/Tân Quý, F Tân Quý, Q Tân Phú, TP. HCMDiện Tích: 4 x 12,05 = 49m2Giá 4,25 tỷ- 1 trệt 1 lầu BTCT 2 pn, 2wc ban công, công nhận đủ 48.2m2. Nhà mới vào ở ngay.-Ngang 4 dài 12.05-Hẻm thông thoáng, cực kỳ an ninh, yên tĩnh.-Sổ Hồng vuông vức chính chủ, hoàn công đầy đủ, công chứng nhanh. *Hướng: BẮCLH: 0934058039 để xem nhà",4 tỷ 250 triệu
22370336,18/10/2023,"Thạch Lam, Phường Phú Thạnh, Quận Tân Phú, TPHCM",,200 m2 (12x17),4,5,Sổ hồng,"BIỆT THỰ MẶT TIỀN QUẬN TÂN PHÚ THẠCH LAM, 12X17, 4 TẦNG, NHỈNH 23 TỶTỌA LẠC NGAY TRUNG TÂM THẠCH LAM VÀ THOẠI NGỌC HẦU, KỀ BÊN KHU ẨM THỰC NGUYỄN SƠN, RICHSTAR TÔ HIỆUBIỆT THỰ GỒM 4 PHÒNG NGỦ, 5 WC, SÂN Ô TÔ, NỘI THẤT CAO CẤPVị trí: tiện lưu thông về Lũy Bán Bích, Hòa Bình, Nguyễn Sơn, Tô Hiệu, Âu CơTiện ích: bán kính 200m có đầy đủ tiện ích; dễ dàng di chuyển về Quận Tân Bình, Quận 6, Quận 11, Quận 10 và Quận 5Shr, còn thương lượng chính chủ, bui huu quocLH HẢI NHÀ PHỐ: 0909599560",23 tỷ 900 triệu
22315138,18/10/2023,"Lê Trọng Tấn, Phường Sơn Kỳ, Quận Tân Phú, TPHCM",,68 m2 (4x17),3,3,Sổ hồng,"LY DỊ bán nhà Lê Trọng Tấn TP-68m2/1,18 Tỷ-SHR-gần ĐH CÔNG THƯƠNG LH chị Thư-  Ví trí: Lê Trọng Tấn, p.Sơn Kỳ, Tân Phú,tp Hồ Chí Minh- Kết cấu: 1 trệt 1 lầu, 3 phòng ngủ 3 wc, có nhà bếp phòng khách rộng rãi thoáng mát, sinh hoạt gia đình, tiếp khách thoải mái- Diện tích: 68m2, ngang 4m, dài 17m- Giá TT: 1 Tỷ 180 triệu anh chị thiện chí mua nhanh bán gọn tặng lại 3 chỉ vàng lấy lộc.*Tiện ích: Vị trí đẹp, gần chợ lớn nhỏ, chợ tự phát, gần trường ĐH Công Thương, dân cư đông, tiện kinh doanh mua bán quán ăn quán uống ăn theo, cho sinh viên thuê trọ, cho thuê mặt bằng,...- Khu vực an ninh tốt, dân trí cao,sinh viên đông, không trộm cắp, hàng xóm vui vẻ thân thiện. Về ở an tâm về an ninh khu vực.- Sổ hồng riêng, sang tên công chứng trong ngày.- Đầy đủ tiện nghi, dọn vào ở ngay. Miễn tiếp cò lái, môi giới trung gian!LH CHỊ THƯ 0707404490 CHÍNH CHỦ",1 tỷ 140 triệu
22369192,16/10/2023,"Tây Thạnh, Phường Tây Thạnh, Quận Tân Phú, TPHCM",254 m2,"133 m2 (6,5x20)",4,3,Sổ hồng,"Khu phân lô cao tầng, hàng xóm thân thiện, dân trí cao, tiện ích đầy đủ. Hẻm ô tô tránh lòng đường 6m, lề đường mỗi bên 2m, sạch sẽ an ninh. Biệt thự 3 tầng BTCT có 4PN 3WC, gara xe hơi, sân để xe máy rộng rãi.Chủ tặng hết nội thất cao cấp cho khách thiện chí.Sổ hồng riêng nở hậu, pháp lý chuẩn, hoàn công đầy đủ, đang vay Bank 8 tỷ.Giá 13 tỷ Thương lượng mạnh",13 tỷ
22271653,04/10/2023,"Thoại Ngọc Hầu, Phường Phú Thạnh, Quận Tân Phú, TPHCM",299 m2,75 m2 (5x14),6,6,Sổ hồng,"HẺM NHỰA 8M TÂN PHÚ GIÁP TÂN BÌNH - NGANG 5x15 THANG MÁY  XỊN SÒ- Gồm 6PN, 6WC, bếp, phòng khách, sân rộng, ban công … OTO NGỦ TRONG NHÀ. - Khu phân lô cao cấp, dân trí cao, an ninh- Xe hơi ra vào thoải mái, Sát công viên thoáng mát. - Sổ đẹp, vuông vức, pháp lý sạch, công chứng ngay.-  Thích hợp vừa ở vừa kinh doanh",11 tỷ 500 triệu
22324762,02/10/2023,"Gò Dầu, Phường Tân Quý, Quận Tân Phú, TPHCM",,134 m2 (5x27),6,4,Sổ hồng,"SIÊU HÓT - CHỈ 1 CĂN ĐƯỜNG GÒ DẦU 134m2 Chỉ 4 Tỷ.Nhà 3 tầng đúc BTCT sân thượng, 6 PN, 4WC, bếp ôtô vào ngủ nhà.",4 tỷ
22328071,29/09/2023,"Nguyễn Quang Diêu, Phường Tân Quý, Quận Tân Phú, TPHCM",,160 m2 (8x20),52,52,Sổ hồng,"Bán nhà đường Nguyễn Quang Diêu, P.Tân Quý, Tân Phú8m x 20m, 162m2Xây dựng 1 hầm 6 tầngGồm 52 phòng căn hộ dịch vụThu nhập 220 triệu/thBán 32 tỷliên hệ ; 0931218345",32 tỷ
22282411,18/09/2023,"Trần Quang Cơ, Phường Phú Thạnh, Quận Tân Phú, TPHCM",214 m2,102 m2 (6x16),5,5,Sổ hồng,"GIẢM 1,3 TỶ - GẤP BÁN-	Hẻm nhựa 5m thẳng 1 trục , ô tô vào nhà – cách 1 căn ra mặt tiền-	 Ngang 6m * 17m rộng rãi- nội thất xịn sò-	 Kết cấu 3 tầng, vừa ở vừa cho thuê lối đi riêng, dòng tiền  10 triệu/tháng.-	 Pháp lý sạch, sổ vuông vức – hỗ trợ vay ngân hàng",7 tỷ 99 triệu
22147947,31/08/2023,"Lũy Bán Bích, Phường Tân Thành, Quận Tân Phú, TPHCM",,150 m2 (8x18),8,9,Sổ hồng,"Bán Biệt Thự Mặt Tiền khu Luỹ Bán Bích - Tân Phú . Khu Giáp Tân Bình. Giá chỉ 24Tỷ 500 TL.- DT: 8x18m Hầm. 4 Lầu. Có thang máy.- Vị Trí: Mặt tiền đường 12m ngay vị trí rộng thoáng giao nhau của nhiều đường lớn nhộn nhịp . Nhà trang trí rất đẹp và sang trọng. Gần tất cả các chợ trường học y tế.- NHÀ ĐẶC BIỆT CÓ THANG MÁY CAO CẤP, có Gara xe Ô tô- Giá bán : 24 tỷ 500 TL.** Liên Hệ : 0937 67 1116 (Gặp em Tâm) Để Tư Vấn Và Xem Nhà . Bên Cạnh Đó Công Ty Em Còn Rất Nhiều Sản Phẩm BĐS Đẹp Khác Giá Tốt Nhất Thị Trường.** Nhận Ký Gửi Các BĐS Các Quận TP-HCM.** Tìm Các Sản Phẩm BĐS Theo Yêu Cầu Của Khách.",24 tỷ 500 triệu
22302905,17/08/2023,"Thống Nhất, Phường Tân Thành, Quận Tân Phú, TPHCM",210 m2,90 m2 (5x14),4,5,Sổ hồng,"cần bán gấp nhà HXH 5M Thống Nhất-P.Tân Thành-Q.Tân Phú,Ngang 5m dài 16mKết cấu 1 trệt 3 lầu Sân Thượng, 4phòng ngủ 5 wcHẻm xe hơi rộng rãi, sạch đẹp. Ô tô tránh nhau thoải mái, khu dân trí cao",5 tỷ 500 triệu
22259112,08/08/2023,"Độc Lập, Phường Tân Quý, Quận Tân Phú, TPHCM",120 m2,"60 m2 (3,5x17)",3,2,Sổ hồng,+ MẶT TIỀN KINH DOANH ĐƯỜNG ĐỘC LẬP - MẶT ĐƯỜNG CHO THUÊ. BUÔN BÁN KINH DOANH ĐA NGÀNH NGHỀ+ DT 60M² x 2 tầng. Kinh doanh. Cho thuê tốt.+ Đất vuông vắn. Nhà sẵn ở. Cho thuê. Kinh doanh cho thuê đa ngành+ Pháp lý chuẩn. Sổ hồng riêng. Mua bán công chứng ngay. + Giá bán 7 tỷ 900,7 tỷ 900 triệu
22190302,27/07/2023,"Lũy Bán Bích, Phường Hòa Thạnh, Quận Tân Phú, TPHCM",,130 m2 (8x16),8,9,Sổ đỏ,"BIỆT THỰ Q.TÂN PHÚ LŨY BÁN BÍCH, ĐƯỜNG 8M, NGANG 8X16, 4 TẦNG THANG MÁY- NỘI THẤT SANG TRỌNG - CHỈ 147 TRIỆU/M2 TLTỌA LẠC TẠI TRUNG TÂM Q.TÂN PHÚ LŨY BÁN BÍCH - THOẠI NGỌC HẦU; BÁN KÍNH 200M CÓ PHỐ ẨM THỰC NGUYỄN SƠN, BỆNH VIỆN QUẬN TÂN PHÚ, VÀI PHÚT ĐẾN CÔNG VIÊN ĐẦM SENBiệt thự gồm 8 phòng ngủ, garage, sân thượngVị trí: tiện lưu thông về Âu Cơ, Hòa Bình, Nguyễn Sơn, Kênh Tân Hóa, Hòa Bình, Tô HiệuTiện ích: bán kính 200m có đầy đủ tiện ích; dễ dàng di chuyển về Quận 11, Quận 10, Quận 6, Quận Tân Bình, Quận 5Shr, còn thương lượng chính chủ, ngo ngoc tamLH HẢI NHÀ PHỐ: 0909599560",19 tỷ 190 triệu
22224754,27/07/2023,"Thoại Ngọc Hầu, Phường Hiệp Tân, Quận Tân Phú, TPHCM",,430 m2 (8x54),9,10,Sổ hồng,"BIỆT THỰ MẶT TIỀN THOẠI NGỌC HẦU QUẬN TÂN PHÚ, 430M2 (8X54) , 5 TẦNG THANG MÁY, NHỈNH 50 TỶ TL - TẶNG TOÀN BỘ NỘI THẤT CHÂU ÂU HƠN 20 TỶTỌA LẠC TẠI VỊ TRÍ ĐẮC ĐỊA, KHU VỰC KINH DOANH SẦM UẤT TRỤC NGUYỄN SƠN VÀ THOẠI NGỌC HẦU, KỀ BÊN KHU CHỢ VẢI PHÚ THỌ HÒA, KHU ẨM THỰC KÊNH TÂN HÓA, PHỐ NỘI THẤT LŨY BÁN BÍCHĐƯỜNG RỘNG THOÁNG 10M, VĨA HÈ 3MBIỆT THỰ GỒM NỘI THẤT NHẬP KHẨU CHÂU ÂU, THIẾT BỊ VỆ SINH KOHLER CỦA ĐỨC, SÀN GỖ PƠ MU, CHÙM ĐÈN PHA LÊ TIỆP KHẮC, CỬA GỖ LIM NAM PHI, THANG MÁY MISTUBISHI NHẬT BẢN, HỆ THỐNG CỬA EUROWINDOWBiệt thự gồm 9 phòng ngủ, 2 phòng khách, quầy bar, 8 phòng tắm thiết kế nội thất Châu Âu cao cấp.Vị trí: nổi nhất khu phố, khu kinh doanh ngày về đêm, tiện lưu thông về Nguyễn Sơn, Âu Cơ, Bàu Cát, Tân Hương, Hòa Bình, Bờ Bao Tân Thắng, Tô Hiệu, Lũy Bán Bích.Tiện ích: Mặt tiền kinh doanh nhiều ngành nghề cao cấp như Spa, Salon Oto,...; dễ dàng di chuyển về Quận Tân Bình, Quận 6, Quận 10, Quận 11, Quận 5.Nhà hiếm trong tầm giá, SHR, nở hậu, còn thương lượng chính chủ, phan anh.LH Hải Nhà Phố: 0909599560",50 tỷ
22224885,27/07/2023,"Chế Lan Viên, Phường Tây Thạnh, Quận Tân Phú, TPHCM",,135 m2 (7x20),4,4,Sổ hồng,"BIỆT THỰ MINI Q.TÂN PHÚ CHẾ LAN VIÊN, ĐƯỜNG 10M, NGANG 7X20, 3 TẦNG, NHỈNH 12.7 TỶTỌA LẠC GẦN TRỤC CHẾ LAN VIÊN VÀ TRƯỜNG CHINH, KỀ BÊN KHU SÔI ĐỘNG LÊ TRỌNG TẤN VÀ TÂN KỲ TÂN QUÝ, KCN TÂN BÌNH, ĐẠI HỌC CÔNG NGHỆ THỰC PHẨM, KHU SÂN GOLD TÂN SƠN NHẤTBiệt thự gồm 1 gara oto, 4 phòng ngủ và 4 WC ; tặng nội thất cho khách thiện chí gồm giàn Tivi HD 80 icnh, Tủ lạnh cao cấp 500L, bộ bàn ghế so pha cao cấp, ....Vị trí: tiện lưu thông về Âu Cơ, Cộng Hòa, Tây Thạnh, Bờ Bao Tân Thắng, Lũy Bán BíchTiện ích: bán kính 200m có chợ, khu thể thao Tây Thạnh, trường học; dễ dàng di chuyển về Quận Tân Bình, Quận Phú Nhuận, Quận 11, Quận 10, Quận 3, Quận Gò VấpShr, nở hậu, còn thương lượng chính chủ, luong thanh haiLH HẢI NHÀ PHỐ: 0909599560",12 tỷ 990 triệu
22001416,16/07/2023,"Trương Vĩnh Ký, Phường Phú Thạnh, Quận Tân Phú, TPHCM",,200 m2 (12x20),4,3,Sổ hồng,"Đi định cư nước ngoài cần bán gấp Biệt Thự Cao cấp Tân Phú.- Diện tích: 12 X 20m- Kết cấu: 3 TẦNG- Vị trí: Khu biệt thự cao cấp sang trọng.- Pháp lý: Sổ hồng chính chủ công chứng nhanh.- Giá: 25,5 tỷ------------------------------------------------------------------------------------LH: 0938.780.781 Nguyễn_Trãi (zalo/ call) để xem trong và thương lượng trực tiếp chủ nhà.( MIỄN TRUNG GIAN)",25 tỷ 500 triệu
22234498,11/07/2023,"Lê Trọng Tấn, Phường Sơn Kỳ, Quận Tân Phú, TPHCM",,120 m2 (10x12),4,4,Sổ hồng,"Biệt thự nằm gần nhà văn hóa thiếu nhi đường Lê Trọng Tấn Quận Tân Phú và trường Đại học Công nghiệp Thực phẩm, cũng như chợ Sơn Kỳ và siêu thị Aeon Tân Phú. Vị trí thuận lợi, chỉ cách mặt tiền đường 3 căn nhà.Diện tích đất rộng 10×12 120m²xây dựng 1 trệt 2 lầu 4PN 4WC 1 phòng ngủ masterGiá bán 2 tỷ 167 triệu thương lượng nhẹLiên hệ Phương Nhiên xem nhà",2 tỷ 167 triệu
22109136,18/06/2023,"Lê Trọng Tấn, Phường Sơn Kỳ, Quận Tân Phú, TPHCM",,"88 m2 (7x12,5)",4,45,Sổ hồng,"Tân Phú - khu biệt thự vip - ngang 7m cách mặt tiền 3 căn - ô tô vào nhà - hẻm xe tải thông vi vu - 7x12.5m, nhỉnh 11tỷ TL.Khu cán bộ, nhà giàu sinh sống, dân trí cao.- Kết cấu: Nhà 1 trệt 1 lửng 1 lầu, sân thượng, phòng.Khách gara để xe, 3 phòng ngủ, 4WC, bếp...- Vị trí: Nhà nằm trong khu vực phân lô bàn cờ, thông ra nhiều hướng, gần UBND, trường học, khu vực nhiều tiện ích xung quanh.- Nhà xe hơi ngủ trong nhà, chủ thiết kế thông thoáng, cửa cách âm, nội thất xịn sò.- Chủ nhà thiện chí bán. Nhà mới xây 3 năm.Pháp lý chuẩn. Công chứng ngay.LH Dương: 0935053878.",11 tỷ
22084528,18/06/2023,"Thoại Ngọc Hầu, Phường Phú Thạnh, Quận Tân Phú, TPHCM",360 m2,120 m2 (8x14),4,5,Sổ hồng,"🆘🆘🆘  Thoại Ngọc Hầu, Tân Phú 114m2,  Ngang Bề Thế 8m, Hẻm Xe Tải, Chỉ 13tỷ xxx.+ Tổng 114m2, 3 Tầng, (8x14)+ Kết cấu 3 tầng, 4pn, 3wc nhà cực kỳ đẹp, chủ nhà là ngừoi kinh doanh nên căn nhà chủ đứng ra xây nên rất tâm huyết.+ Bề ngang 8m khá rộng và thoải mái cho việc sinh hoạt gia đình hay vừa ở vừa kinh doanh.+ Xe ô tô ngủ trong nhà hoặc để trước nhà cũng được, nội thất chủ để lại hoàn toàn.+ Vị Trí Vip Kết Nối Các Quận Trung Tâm.—liên hệ A Dương: 0935053878 xemNhà",13 tỷ
22051727,02/06/2023,"Đường A, Phường Phú Thạnh, Quận Tân Phú, TPHCM",260 m2,"141 m2 (11,5x12,5)",5,5,Sổ hồng,"Chủ bán gấp đi định cư biệt thự 144m 11,5x12,5 giá chỉ nhỉnh 80tr m rẻ hơn khu vực 20% Cao cấpMô tảBán gấp đi định cư biệt thự 144m 11,5x12,5 giá chỉ 80tr  m khu ADC Quận Tân Phú . Mô tả : ✅ Kết cấu trệt 2 lầu nhà còn rất đẹp. Có sân vườn rộng rãi thoáng mát đậu oto thoải mái. ✅ Vị trí đắc địa nhất Quận Tân Phú ngay trung tâm Quận. Cạnh UNND Quận với rất nhiều tiện ích: Coo Mart, Chợ Trường học các cấp, Đại Học,. Bệnh viện Quận…Giao thông thuận tiện kết nối ra Luỹ Bán Bích- Âu Cơ- Thoại Ngọc Hầu- Tân Hoá và đại các quận trung tâm chỉ chỉ 5 phút. ✅ Giá chỉ nhỉnh 80tr m vuông rẻ hơn giá Khu Vực 20% . Bao k có căn thứ hai. 👉👉👉 Chủ gấp bán đi định cư Pháp nên thương lượng được giá tốt. ✅ Call 0775777781 -0886667918 Sơn Trần Land để được hổ trợ xem nhà và gặp chủ thương lượng.",11 tỷ 700 triệu
21395183,15/05/2023,"Nguyễn Đỗ Cung, Phường Tây Thạnh, Quận Tân Phú, TPHCM",,117 m2 (1x1),1,1,Không xác định,"CTY TNHH TIẾP THỊ VÀ MÔI GIỚI CHUYÊN NGHIỆP 357NHẬN GỬI NHÀ CHÍNH CHỦ TẠI TP.HCMTỔNG ĐÀI TƯ VẤN 1900638006* Diện tích: 6,5x18m vuông vắn, xây 1 trệt 4 lầu có 12p cho thuê thu nhập 30tr/tháng.-* Vị trí: Cách trường ĐH Công Nghệ Thực Phẩm 500m, gần Aeon Tân Phú, cách Lê Trọng Tấn 50m, gần chợ, Bách Hóa Xanh.-* Đặc điểm: Vị trí tuyệt đẹp trong khu nội bộ 30 căn, có công viên nội bộ, đường rộng rãi hơn 10m, khu văn minh dân trí cao.* Giá tốt 11,6 tỷ còn TL. Chủ nhà cực dễ thương (ảnh minh họa).",11 tỷ 600 triệu
