Ma_BDS,Ngay_dang,Dia_chi,Dien_tich_su_dung,Dien_tich_dat,So_phong_ngu,So_nha_tam,Phap_ly,Gioi_thieu,Gia_dat
21594342,03/05/2022,"Lũy Bán Bích, Phường Phú Thạnh, Quận Tân Phú, TPHCM",550 m2,140 m2 (8x17),5,5,Sổ hồng,"Bán Nhà Khu Nhà Ở cao cấp Nhà Phố - Biệt thự  [Versaltile Home Bào Sơn Tân Phú]Biệt Thự Versaltile Home.Vị Trí: Mặt tiền Nguyễn Sơn - Thoại Ngọc Hầu, Q. Tân Phú.Phù hợp mở công ty, Spa, Phòng Gym, kinh doanh, cho thuê...Quy mô: 5000m2.Tổng số sản phẩm: 50 căn nhà phố, biệt thự.Mật độ xây dựng toàn khu: 98.9%.Diện Tích: 4,5x23m2, 8x16m2, 4X18m2.Kết cấu: 1 Trệt 4 Lầu, gồm: 6PN, 1Phòng khách, 7 Tolet, 1 PhòngThờ, 2 ban công trước sau, 2 giếng trời tại cầu thang và phòng ngủ sau nên nhà luôn thoáng mát, ) đặt biệt có thiết kế thang máy gia đình.Sổ hồng riêng (nhà mới đẹp 100% vào ở liền Công chứng trong ngày).Hình thức sở hữu: Lâu dài.Giá chỉ từ 15 tỷ 200.Chỉ cần thanh toán 30% nhận nhà liền.Hỗ trợ tài chính: Ngân hàng hỗ trợ 70% (hỗ trợ năm đầu tiên không lãi suất).Liên hệ : 0937 587845",25 tỷ 200 triệu
21596101,03/05/2022,"Nguyễn Sơn, Phường Phú Thạnh, Quận Tân Phú, TPHCM",350 m2,"80 m2 (4x18,5)",5,5,Sổ hồng,"VERSATILE HOME khu phố thương gia nằm ngay trung tâm quận Tân Phú kinh doanh mọi ngành nghề.Với vị trí đắc địa nằm mặt tiền Lũy Bán Bích – Nguyễn Sơn, đối diện UBND quận Tân Phú và cách khu du lịch Đầm Sen chỉ có 3km.- Trong vòng bán kính 500m đầy đủ tiện ích như:+ Hệ thống ngân hàng: ACB, Sacombank, Agribank…+ Hệ thống trường học: Tiểu học Trần Quốc Toản, THCS Trí Đức, THPT Nguyễn Thượng Hiền, ĐH Kinh tế tài chính, ĐH Bách Khoa, ĐH Hồng Bàng…+ Hệ thống bệnh viện: BV Tân Phú, BV Thống Nhất..+ Gần các trung tâm mua sắm giải trí: Galaxy Tân Bình, Aeon Mall Tân Phú, Pandora City, chợ Bàu Cát, Big C Phú Thạnh…Kết cấu gồm 1 trệt 4 lầu:- Có 6 phòng ngủ,7wc,phòng thờ và phòng giặt riêng.- Khu vực an ninh cao có camera giám sát 24/24.- Đường nhựa 12m,xe ô tô quay đầu thoải mái.- Có thang máy tiện nghi trong chính ngôi nhà của bạn.- Diện tích 8m*16m, 4*18m...- Giá Bán : từ 15,2 tỷ /Căn- Liên hệ : 0937 587845-",15 tỷ 200 triệu
21596109,03/05/2022,"Lũy Bán Bích, Phường Phú Thạnh, Quận Tân Phú, TPHCM",550 m2,140 m2 (8x17),5,5,Sổ hồng,"Phố Thương Gia Versatile Home ngay trung tâm UBND Quận Tân Phú! Duy nhất 41 căn!Xây dựng đồng bộ, nằm ngay mặt tiền UBND Quận Tân PhúGiá niêm yết từ 15.2 tỷ/cănBao gồm: biệt thự 8x16m : Kết cấu : 1 trệt 4 lầu  nhà phố 4x18m: Kết cấu :  1 trệt 4 lầuThích hợp kinh doanh mọi nghành nghề như: khách sạn, online, spa, văn phòng,......Thanh toán 30% nhận nhà ngayƯu đãi lên đến 10% cho khách công chứng nhanh   -  Liên hệ : 0937 587845",25 tỷ 200 triệu
21596112,03/05/2022,"Nguyễn Sơn, Phường Phú Thạnh, Quận Tân Phú, TPHCM",550 m2,140 m2 (8x17),5,5,Sổ hồng,"Vị trí: Mặt tiền 57 Nguyễn Sơn, P. Phú Thạnh, Quận Tân Phú TP. Hồ Chí Minh.Số lượng: 72 căn (20 căn biệt thự - 7 căn nhà phố mặt tiền 45 căn nhà phố liền kề).Diện tích : 75m2 - 150m2.Pháp lý: Sổ hồng riêng từng căn, bao công chứng.Hạ tầng: Điện nước hoàn thiện, vị trí không ngập.Giao thô (hoàn thiện mặt ngoài, bên trong tùy theo thiết kế của khách hàng phù hợp với mọi loại hình kinh doanh).Ngân hàng hỗ trợ: ACB bảo lãnh cho vay lên đến 50 70% tổng giá trị. Tối đa 20 năm.Thanh toán: Giá từ 15.2 tỷ - Liên hệ : 0937 587845",25 tỷ 200 triệu
21596130,03/05/2022,"Nguyễn Sơn, Phường Phú Thạnh, Quận Tân Phú, TPHCM",550 m2,140 m2 (8x17),5,5,Sổ hồng,"nhà phố biệt thự KDC Versatile Home, mặt tiền trung tâm quận Tân Phú, chỉ từ 15 tỷ/cănThông tin chi tiết:* Kết cấu: Nhà biệt thự & phố mặt tiền, có sổ riêng.* Vị Trí: MTKD Phường Phú Thạnh, Quận Tân Phú.- Hướng: Hướng Nam, tây, Đông.- Đặc điểm: Vị trí rất thuận lợi, nhà xây rất kiên cố, hàng xóm vui vẻ, chủ nhà thiện chí bán, diện tích thích hợp xây biệt thự sân vườn, nhà xưởng, trung tâm...- Diện tích: 8x16m, 4x19m, 6x23m nhà chính chủ.Thanh toán 30% nhận nhà ngay!Hỗ trợ vay NH 70% - Chiết khấu lên đến 10% cho khách 10 khách hàng đầu tiênLiên hệ : 0937 587845",25 tỷ 200 triệu
21608434,03/05/2022,"Nguyễn Sơn, Phường Phú Thạnh, Quận Tân Phú, TPHCM",550 m2,140 m2 (8x16),5,5,Sổ hồng,"nhà phố biệt thự KDC Versatile Home, mặt tiền trung tâm quận Tân Phú, chỉ từ 15 tỷ/cănThông tin chi tiết:* Kết cấu: Nhà biệt thự & phố mặt tiền, có sổ riêng.* Vị Trí: Khu Nhà ở cao cấp, MTKD Phường Phú Thạnh, Quận Tân Phú.- Đặc điểm: Vị trí rất thuận lợi, nằm trong khu nhà cao cấp tại Nguyễn Sơn Phường Phú Thạnh, Quận Tân Phú, TpHCM.Nhà xây rất kiên cố, Khu Dân trí cao, An ninh, - Diện tích: 8x16m, 4x19m, 6x23m nhà chính chủ.Giá chỉ từ 15, 2 tỷ / căn - 25 tỷ/cănThanh toán 30% nhận nhà ngay!Hỗ trợ vay NH 70% - Chiết khấu lên đến 10% cho khách 10 khách hàng đầu tiênLiên hệ : 0937 587845 ( để được tư vấn vị trí đẹp Giá tốt nhất)",25 tỷ
21499876,01/05/2022,"Tân Quý, Phường Tân Quý, Quận Tân Phú, TPHCM",,65 m2 (4x16),4,5,Sổ hồng,"TÂN PHÚ – HXH – SÁT MẶT TIỀN – CHÍNH CHỦ 1 ĐỜI.** Diện tích: 65m.** Kết cấu BTCT 1 trệt 2 lầu sân thượng.** Sở hữu 3 PN. 3 WC, bếp phòng khách ban công, xe hơi trong nhà!** Vị trí đẹp, sát mặt tiền, sát AEONMAIL, tiện ích xung quanh không thiếu gì.**  Sổ đẹp, vuông vức, hoàn công đầy đủ, pháp lý sạch, công chứng ngay.## 0933797470.##bán nhà mặt tiền Gò Dầu##  bán nhà HXH Tân Sơn Nhì",7 tỷ
21578457,28/04/2022,"Nguyễn Sơn, Phường Phú Thạnh, Quận Tân Phú, TPHCM",400 m2,160 m2 (8x20),4,5,Sổ hồng,"Biệt thự ốp gỗ như hình ( không làm mất thời gian của khách ) Vị trí: Khu vực Thoại Ngọc Hầu - Nguyễn Sơn. Trung tâm của quận Tân PhúThiết kế 1 trệt 3 lầu tích hợp THANG MÁY GIA ĐÌNH, khu vực để xe oto riêng, đầy đủ công năng.Khu dân cư văn minh, lịch sự, không ồn ào.Vị trí thuận lợi kết nối các quận trung tâm chỉ 15 phút đi xePháp lý sổ hồng riêng, có sẵnNgân hàng hỗ trợ 70%Chiết khấu ngay 10% cho khách nhanh tay đặt cọcLiên hệ: 076 78 33. 95",28 tỷ 500 triệu
21555753,04/04/2022,"Lũy Bán Bích, Phường Phú Thạnh, Quận Tân Phú, TPHCM",322 m2,168 m2 (11x17),4,6,Sổ hồng,"Bán biệt thự 168m2 ngay khu dân cư ADC Đường Lũy Bán Bích, Phường Phú Thạnh, Quận Tân Phú, gần ngã ba Trịnh Đình Trọng.Diện tích: 11m x 17m - DTCN 168m2 - DT sàn 322,26m2 - hướng Đông BắcThiết kế: 1 trệt 2 lầu sân thượng - nội thất cao cấpPháp lý: sổ hồng chính chủVị trí: hẻm xe hơi ra vào thoải mái, khu vực yên tĩnh, dân trí caoGiá 16,5 tỷ LH: Mr. Dũng 0903318938",16 tỷ 500 triệu
21545441,30/03/2022,"Nguyễn Cửu Đàm, Phường Tân Sơn Nhì, Quận Tân Phú, TPHCM",,"127 m2 (8,4x15,2)",6,7,Sổ hồng,"Chính chủ gửi bán gấp biệt thự góc 2MT 172/1 Nguyễn Cửu Đàm, Tân Phú.Trung tâm quận Tân Phú.Giáp trường Cấp 1,2 - KTX trường Công Nghệ Thực PhẩmRa AEon Nhật rất gần...DT: 8.40 x 15.2m, 4 tấm, vị trí đẹp trung tâm.Giá bán 16.2 tỷLh: 0909961217 - A Tuấn để xem nhà",16 tỷ 200 triệu
21481346,25/03/2022,"Đường DC8, Phường Sơn Kỳ, Quận Tân Phú, TPHCM",520 m2,200 m2 (10x20),9,10,Sổ hồng,"BIỆT THỰ KIẾN TRÚC CHÂU ÂU ĐẸP MÊ HỒN. Khu BIỆT THỰ cao cấp đang làm văn phòng Công ty Quốc tế.+ DT: 10×20+ Kết cấu: 4 Tầng BTCT,  sân trước, ban công và giếng trời sau rất thông thoáng, mát mẻ.- Tầng trệt: Gara xe hơi, khu vực Lễ tân, phòng tiếp khách riêng và phòng họp nhỏ cho 10 người ngoài ra còn thiết kế quầy Bar nhỏ. - Tầng 1: Phòng Tổng Giám Đốc, Phòng họp và 2 phòng làm việc cho nhân viên. - Tầng 2, 3 và 4 thiết kế mỗi lầu 3 phòng làm việc, phòng nghỉ ngơi cho nhân viên, kho chứa và phòng lưu trữ hồ sơ.+ Các lầu đều có ban công và giếng trời rất thông thoáng. + Nội thất xịn thiết kế sang trọng như khách sạn 5 SAO SHERATON HOTEL. Thang đi bộ và thang máy rất xịn sò thiết kế đậu các tầng, cùng hệ thống camera giám sát 24/24+ Pháp lý cực chuẩn + Chủ rất thiện chí bán. + Liên hệ: 0907001273 gặp Ông Hưng(MTG)",32 tỷ 500 triệu
21540156,22/03/2022,"Lê Cao Lãng, Phường Phú Thạnh, Quận Tân Phú, TPHCM",,220 m2 (11x20),20,20,Sổ hồng,"+ Nhà mặt tiền với chiều ngang thế 11m, đang kinh doanh khách sạn,  masage.+ Nhà gồm 5 tầng BTCT kiên cố, thang máy, 12 phòng KS + 6 phòng massage đang kinh doanh.+ Doanh thu 160-180 triệu/tháng.+ Pháp lý chuẩn, hoàn công đủ, công chứng sang tên ngay.+ Giá đang rất tốt (rẻ hơn thị trường 40%), chỉ 65 triệu/m2.+ Chốt ngay chủ tặng full nội thất xịn sẵn kinh doanh.Liên hệ: 093 181 5670 ( Ms. Trang)",17 tỷ 900 triệu
21523201,16/03/2022,"Nguyễn Hữu Dật, Phường Tây Thạnh, Quận Tân Phú, TPHCM",380 m2,115 m2 (7x16),6,7,Sổ hồng,"Bán nhà biệt phủ đẳng cấp đẹp nhất  – Quận Tân Phú. TPHCM•	Diện tích: 115.5 m2 ( 7x 16)+ Kết cấu : 1 trệt + 3 lầu + sân thượng, 6 PN Master, 7 WC khép kín.+  Mặt tiền hẻm nhựa 10m, ở thông thoáng thuận tiện, an ninh rất tốt.+  Vị trí: Gần đại học Công nghiệp thực phẩm, sân bay, sân Golf .  Khu biệt phủ đẳng cấp xa hoa bậc nhất Quận Tân Phú. TPHCM+ Sổ hồng vuông vức, công chứng ngay.•	Gía 18.5 tỷ•	Liên hệ : Mrs Dung – (0902695189)",18 tỷ 500 triệu
21521689,05/03/2022,"Sơn Kỳ, Phường Sơn Kỳ, Quận Tân Phú, TPHCM",325 m2,65 m2 (5x13),7,8,Sổ hồng,"5mx13m nhà HXH đường Sơn Kỳ quận Tân Phú, 5 tầng đúc chỉ 7,39 tỷ.-	Nhà nằm trong khu VIP của quận Tân Phú, giáp Tân Bình. Đi bộ ra siêu thị AEON, chợ Sơn Kỳ, Trường mẫu giáo, cấp 1,2,3 đại học Công nghệ thực phẩm..-	Đường xe tải quay đầu thoải mái, xe hơi vô tư vào nhà, hẻm sạch sẽ, dân trí cao thoáng mát, toàn công ty.-	Nhà thiết kế lệch tầng, hiện đại theo phong cách châu âu. Gồm 1 trệt 1 lửng 3 lầu sân thượng.-	Đầy đủ công năng cho đại gia đình ở, tổng 6 phòng ngủ khép kín, 7 wc, 2 phòng khách, phòng thờ, giặt, bếp, giếng trời đầy đủ.-	Nhà ngang 5m cực hiếm, chính chủ xây ở nên rất chắc chắn, nhà mới khách về ở ngay.-	KHÁCH VÀO XEM LÀ ƯNG NGAY.-	Sổ hồng riêng, chính chủ ở và bán, sang tên ngay luôn trong ngày.-	Giá chỉ 7,39 tỷ còn thương lượng.-	Chủ cần bán nên giá không thể còn có căn nào chất lượng mà có giá tốt hơn.-	Goị ngay 0786596365 để gặp chủ mua nhà.-	NHÀ TÌM LÀ CÓ - ĐẤT KIẾM LÀ RA",7 tỷ 390 triệu
21509559,04/02/2022,"Bờ Bao Tân Thắng, Phường Sơn Kỳ, Quận Tân Phú, TPHCM",720 m2,180 m2 (12x15),6,7,Sổ hồng,"Biệt Thự Tân Phú Ngay Siêu Thị AonMall 180m2, 4 Lầu Kinh Doanh Đỉnh Diện tích ngang 12m dài 15m Thiết kế sang trọng hiện đại nội thất đẹpKhách mua ở hoặc chuyển công năng làm Nhà Hàng, Khách Sạn, Văn phòngTiện ích đầy đủ không thiếu thứ gì gần Celadon cty cây xanh nhiều mát mẻSổ hồng vuông vức pháp lý rõ ràng công chứng ngayGiá 29 tỷ thương lượngGọi ngay 0975013898",29 tỷ
21395905,19/01/2022,"Nguyễn Súy, Phường Tân Quý, Quận Tân Phú, TPHCM",,68 m2 (1x1),1,1,Không xác định,"CTY TNHH TIẾP THỊ VÀ MÔI GIỚI CHUYÊN NGHIỆP 357NHẬN GỬI NHÀ CHÍNH CHỦ TẠI TP.HCMTỔNG ĐÀI TƯ VẤN 1900638006Mô tả:+ Nhà kết cấu 2 tầng BTCT, xây kiểu biệt thự, đẹp, hài hòa. Nhà sát mặt tiền đường Nguyễn Súy, đường hẻm nội bộ rộng hơn 4m có thể để được vài chục xe honda, ô tô đổ trước nhà, thoáng mát, sạch sẽ, an ninh, pháp lý chuẩn, hoàn công đầy đủ, công chứng trong ngày.+ Khu vực trung tâm Tân Phú thích hợp vừa để ở, vừa làm văn phòng công ty, kinh doanh online, cafe.. Ngay Gò Dầu, Tân Hương. Dễ dàng duy chuyển về Trương Vĩnh Ký, Lũy Bán Bích, Âu Cơ, Tân Sơn Nhì, Tân Kỳ Tân Quý và các quận Tân Bình, Bình Tân, Quận 11, Quận 12, Gò Vấp, Hóc Môn,",7 tỷ 600 triệu
21508967,19/01/2022,"Bờ Bao Tân Thắng, Phường Sơn Kỳ, Quận Tân Phú, TPHCM",180 m2,172 m2 (12x15),6,5,Giấy tờ hợp lệ,"Địa chỉ : 139/11-13-15 Bờ Bao Tân Thắng, P.Sơn Kỳ,Q.Tân Phú -Diện tích : 180m2 ( công nhận 172m2) 12x15- Mô tả : 4 tầng, Sổ vuông vức, không quy hoạch, không lộ giới, ngang 12m2 bề thế, đối diện siêu thị eon, khách mua kinh doanh nhà hàng, quán xá, có thể gửi xe eon.- Giá: 29 tỷ - Liên hệ : 0934.469.578( Mr. khang )",29 tỷ
21494186,17/01/2022,"Trịnh Đình Trọng, Phường Phú Trung, Quận Tân Phú, TPHCM",,54 m2 (6x9),4,4,Sổ đỏ,"HẺM XE HƠI TRỊNH ĐÌNH TRỌNG, 54m2, NHÀ ĐẸP HOÀNH TRÁNG LỆ, 7.8 tỷ TLMÔ TẢ :- Khu vực kinh doanh sầm uất.- Hẻm 2 xe hơi đua nhau, rất rộng- Nhà Lô góc, vị trí cực đẹp, vừa ở vừa cho thuê hoặc cho thuê nguyên căn làm công ty đều tiện.- Nhà nở hậu, Sổ riêng, hoàn công đầy đủ, công chứng trong ngày.- Kết cấu: 1 trệt, 1 lững, 2 lầu, sân thượng Phòng khách + bếp (đẹp mê ly )+ 3 Phòng ngủ  + 3 WC +  Phòng thờ. -- Vị Trí: Gần Đầm Sen, gần nhiều trường học. Thông qua các tuyến đường Hòa Bình, Lũy Bán Bích, Lạc Long QuânLH 0839.414.438 Mr Hùng",7 tỷ 800 triệu
21395159,02/01/2022,"Nguyễn Cửu Đàm, Phường Tân Sơn Nhì, Quận Tân Phú, TPHCM",,152 m2 (1x1),1,1,Không xác định,"CTY TNHH TIẾP THỊ VÀ MÔI GIỚI CHUYÊN NGHIỆP 357NHẬN GỬI NHÀ CHÍNH CHỦ TẠI TP.HCMTỔNG ĐÀI TƯ VẤN 1900638006Bán nhà biệt thự khu công viên đường Cầu Xéo, P. Tân Sơn Nhì, Q. Tân Phú.- Diện tích: 8m x 19m.- Kết cấu: 2 lầu, thiết kế đẹp, nội thất cao cấp.- Tiện ích: Gần chợ, trường học, bệnh viện, gần các trục đường chính sầm uất thuận tiện cho việc đi lại và kinh doanh buôn bán.Giá: 17.4 tỷ.",17 tỷ 400 triệu
21395156,02/01/2022,"Nguyễn Cửu Đàm, Phường Tân Sơn Nhì, Quận Tân Phú, TPHCM",,220 m2 (1x1),1,1,Không xác định,"CTY TNHH TIẾP THỊ VÀ MÔI GIỚI CHUYÊN NGHIỆP 357NHẬN GỬI NHÀ CHÍNH CHỦ TẠI TP.HCMTỔNG ĐÀI TƯ VẤN 1900638006Bán biệt thự đường Nguyễn Cửu Đàm, 11mx20m, giá 28.4 tỷ, P. Tân Sơn Nhì, Q. Tân Phú.Vị trí: Hẻm 19 đường Nguyễn Cửu Đàm, gần đường Tân Sơn Nhì, khu nội bộ có công viên cây xanh, dân trí cao, an ninh tốt.Diện tích: 11mx20m, đúc 4 tấm, nội thất cực kỳ cao cấp.",28 tỷ 400 triệu
21460464,25/12/2021,"Quách Đình Bảo, Phường Phú Thạnh, Quận Tân Phú, TPHCM",,60 m2 (4x10),3,4,Sổ hồng,"Bán Căn Góc 2 Mặt Tiền 3 Lầu Đường Quách Đình Bảo Khu Họ Lê Q Tân Phú+++ Vị Trí: Nằm Góc 2 Mặt Tiền Võ Văn Dung- Quách Đình Bảo Khu Họ Lê Phường Phú Thạnh Quận Tân Phú, Đường Trước Nhà 13m Có Lề Đường Rộng Rãi, Khu Nhà Lầu Khang Trang, An Ninh, Dân Trí Cao, Gần Các Tuyến Đường Lớn Như Nguyễn Sơn, Lũy Bán Bích, Di Chuyển Sang Quận 11 Và Tân Bình Rất Thuận Lợi.+++ Diện Tích: 4x7m Nở Hậu Chữ L 8m Đã Chừa Đủ Lộ Giới+++ Kết Cấu : Nhà 1 Trệt 1 Lửng 2 Lầu+++ Hiện Trạng: Nhà Chính Chủ, Sổ Hồng Pháp Lí Rõ Ràng, Hoàn Công Đầy Đủ+++ Hướng : Nam ( Đông Tứ Trạch)+++ Tiện Ích: Xung Quanh Đầy Đủ Các Tiện Ích Như Trường Học Các Cấp, Chợ, Siêu Thị, Trung Tâm Mua Sắm, Ngân Hàng Trong Vòng Bán Kính 50m, Khu Nhà Lầu Khang Trang, An Ninh Môi Trường Sống Lý Tưởng.+++ Giá : 7.65 Tỷ Bớt Lộc",7 tỷ
21489953,25/12/2021,"Lũy Bán Bích, Phường Hòa Thạnh, Quận Tân Phú, TPHCM",,165 m2 (8x22),5,6,Sổ hồng,"Chủ rất thiện chí bán, giảm chào 1 tỷ Căn Biệt Thự Cao Cấp BIỆT THỰ SIÊU SANG - TÂN PHÚ - 8M x 22M - VUÔNG VỨC - FULL NỘI THẤT CAO CẤP - 22 TỶ. Diện tích: 8M x  22M Khu vực hiếm nhà bán khu cao tầng đồng bộ.Biệt thự mới hoàn công 2020-	Diện tích: 8M x 22. Nhà vuông vức, công nhận đủ. -	Nội thất cao cấp, toàn bộ hệ thống bếp Teka của Tây Ban Nha, 5 PN, phòng đọc sách, phòng sinh hoạt chung. Thiết bị vệ sinh ToTo. -	Cửa toilet dùng gỗ đỏ. Sàn gỗ Đức. -	Sân thượng trước sau được ốp gạch và đá hoa cương toàn bộ. Cửa đi khoá từ, vân tay. Gara oto lớn, tách biệt và có lối đi riêng. Tiện ích xung quanh không thiếu gì, tiện di chuyển các quận trung tâm. Sổ hồng đẹp, chính chủ, công chứng ngay. Mặt tiền đường nội bộ 12m, khu nhà có công viên nội bộ, đối diện là Uỷ ban nhân dân phường Hoà Thạnh, cực kỳ an ninh. Thoáng mát, yên tĩnh.Gặp TUÂN HIỆP Tiều Châu – 0936223899",22 tỷ
21488199,23/12/2021,"Phan Anh, Phường Hiệp Tân, Quận Tân Phú, TPHCM",320 m2,80 m2 (5x16),4,6,Sổ hồng,"Bán Biệt thự Quận Tân Phú, đẹp lung linh, cực kỳ an ninh, 13tỷBán Biệt thự đường Phan Anh, Quận Tân Phú, 80m2, 4tầng, 13tỷ👉 Nhà chủ tâm huyết xây ở, thiết kế theo phong cách phương Tây cổ điển, nhìn là yêu ngay.👉 DT: ngang 5 dài 16 sổ vuông A4.👉 Kết cấu: 1 trệt, 3 lầu + sân thượng, 4PN, 6WC, Phòng Thờ, phòng giặt, ban công, giếng trời thoáng mát. Có chỗ đậu ô tô.👉 Vị trí mặt tiền nội bộ, khu vip toàn cán bộ công chức. Đường 8m vỉa hè, thích hợp ở, kinh doanh văn phòng, spa, ăn uống, khách sạn,...👉 Gần chợ, bệnh viện, siêu thị, trường học các cấp, giao thông thuận tiện đi lại.👉 Khu dân cư sầm uất, camera an ninh 24/24.👉 Sổ hồng chính chủ. Công chứng trong 1 nốt nhạc.👉 Giá chỉ 13tỷ (thương lượng chính chủ).👉 Miễn tiếp môi giới, trung gian.👉 Gọi ngay: 0931933661 – Khôi, tư vấn và xem nhà miễn phí.👉 Tôi, MG Nguyên Khôi chuyên bán nhà mặt tiền, biệt thư, nhà hẻm xe hơi, nhà đẹp Quận Tân Phú, Tân Bình, Bình Tân…",13 tỷ
21432126,19/12/2021,"Tô Hiệu, Phường Tân Thới Hòa, Quận Tân Phú, TPHCM",240 m2,60 m2 (5x12),4,3,Giấy tờ hợp lệ,"VIP - NHÀ PHỐ LIỀN KỀ BIỆT LẬP. ----Tân Thới Hoà. Tân Phú. ----- 5 x 12m- Trệt, 2 lầu , sân thượng. - Khu an sinh cao cấp, đầy đủ tiện nghi, an ninh 24/7. Gần khu Du Lịch Đầm Sen. Chung quay đủ tiện ích. - Vị trí vừa ở vừa làm văn phòng kinh doanh. nhà đẹp tân phú, nhà đẹp giá rẻ, bán nhà hẻm xe hơi vào nhà. nhà gần quận 11. nhà quận tân phú giá rẻ, nhà đẹp tân phú giá rẻ",7 tỷ 450 triệu
21396065,18/12/2021,"Nguyễn Thế Truyện, Phường Tân Sơn Nhì, Quận Tân Phú, TPHCM",,120 m2 (1x1),1,1,Sổ đỏ,"CTY TNHH TIẾP THỊ VÀ MÔI GIỚI CHUYÊN NGHIỆP 357NHẬN GỬI NHÀ CHÍNH CHỦ TẠI TP.HCMTỔNG ĐÀI TƯ VẤN 1900638006Bán nhà đẹp vào ở ngay đường Nguyễn Thế Truyện, P. Tân Sơn Nhì, Q. Tân Phú.- DT: 5.3m x 22m nở hậu 5.7m công nhận 120m2.- Kết cấu: 1 trệt 2 lầu sân thượng nhà mới bao gồm nội thất.- Vị trí: Cực đẹp không lỗi phong thủy, khu biệt thự nhà phố.- Pháp lí: Đầy đủ, sổ hồng, sang tên trong ngày.- Gía thương lượng: 15 tỷ.",15 tỷ
21395163,18/12/2021,"Nguyễn Cửu Đàm, Phường Tân Sơn Nhì, Quận Tân Phú, TPHCM",,220 m2 (1x1),1,1,Không xác định,"CTY TNHH TIẾP THỊ VÀ MÔI GIỚI CHUYÊN NGHIỆP 357NHẬN GỬI NHÀ CHÍNH CHỦ TẠI TP.HCMTỔNG ĐÀI TƯ VẤN 1900638006Bán biệt thự đường Nguyễn Cửu Đàm, 11mx20m, giá 28,9 tỷ, P. Tân Sơn Nhì, Q. Tân Phú.Vị trí: Hẻm 19 đường Nguyễn Cửu Đàm, gần đường Tân Sơn Nhì, khu nội bộ có công viên cây xanh, dân trí cao, an ninh tốt.Diện tích: 11mx20m, đúc 4 tấm, nội thất cực kỳ cao cấp.",28 tỷ 900 triệu
21466916,17/12/2021,"Lũy Bán Bích, Phường Tân Thới Hòa, Quận Tân Phú, TPHCM",,"100 m2 (7,5x14)",4,5,Sổ hồng,"Biệt thự thông minh đường Lũy Bán Bích, P. Tân Thới Hòa, Q. Tân Phú, 7.5x14m, 2 lầu, giá 11.5 tỷ.- E đăng bán căn biệt thự hẻm số 44 (hẻm 10m) xe hơi để thoải mái. Đường Lũy Bán Bích P. Tân Thới Hòa Q. Tân Phú.- DT: 7.5x14m vuông vức ko lộ giới (100m2 đất). Là khu biệt thự biệt lập hẻm yên tĩnh chỉ có 14 căn nhà.- Kết cấu: Xây theo kiểu biệt thự 2 lầu, có gara để xe hơi riêng. gồm 4PN 5WC ban công. nhà mới xây hoàn công năm 2018 do định cư nên để lại căn nhà cực kì đẹp- Chủ tặng lại toàn bộ nội thất xịn sò gồm 4 smart tivi, 4 máy lạnh, 1 tủ lạnh 2 cánh- Giá bán 11.5 tỷ, giá còn thương lượng.",11 tỷ 500 triệu
21481008,16/12/2021,"Phan Anh, Phường Tân Thới Hòa, Quận Tân Phú, TPHCM",320 m2,80 m2 (5x16),4,6,Sổ hồng,"BIỆT THỰ ĐẸP LUNG LINH - MẶT TIÊN NỘI BỘ ĐƯỜNG 8M-TIỆN KINH DOANHPhan Anh 80m2  4tầng  (5x16) 12,5 tỷ Tân Thới Hoà Tân Phú Mô tả: (m.tuấn)👉 DT: ngang 5 dài 16Kết cấu: 1 trệt, 3 lầu + sân thượng, 4PN, 6WC, Phòng Thờ, phòng giặt, ban công, giếng trời . Có chỗ đậu ô tô.👉 Vị trí mặt tiền nội bộ, khu vip toàn cán bộ công chức. Đường 8m vỉa hè, thích hợp ở, kinh doanh văn phòng, spa, ăn uống, khách sạn,...👉 Khu dân cư sầm uất, camera an ninh 24/24.👉 Sổ hồng chính chủ, công chứng ngayLiên hệ xem nhà: Sang 0909305015",12 tỷ 500 triệu
21394998,14/12/2021,"Lũy Bán Bích, Phường Phú Thạnh, Quận Tân Phú, TPHCM",,103 m2 (1x1),1,1,Không xác định,"CTY TNHH TIẾP THỊ VÀ MÔI GIỚI CHUYÊN NGHIỆP 357NHẬN GỬI NHÀ CHÍNH CHỦ TẠI TP.HCMTỔNG ĐÀI TƯ VẤN 1900638006Bán biệt thự mini hẻm 6m đường Luỹ Bán Bích, 7.4mx14m, giá: 11.7 tỷ, P. Phú Thạnh, Q. Tân Phú.- Vị trí: Hẻm 6m đường Luỹ Bán Bích, nằm sát mặt tiền đường, gần Hoà Bình, khu nội bộ dân trí cao.- Diện tích: 7.4mx14m, nhà 1 lầu, thiết kế hiện đại, nội thất cao cấp, vào ở ngay được.",11 tỷ 700 triệu
21471449,09/12/2021,"Nguyễn Văn Yến, Phường Tân Thới Hòa, Quận Tân Phú, TPHCM",,54 m2 (5x12),5,5,Sổ hồng,5 x 12m. Nhà lô góc nở hậu tài lộc.4 tầng 5 phòng ngủ.Liền kề khu công viên thoáng mát khu nhà compound có bảo vệ 24/24.Pháp lý chuẩn. Sổ hồng công chứng ngay.ThỐng 0909814990,7 tỷ 490 triệu
21433396,01/12/2021,"Nguyễn Sơn, Phường Phú Thạnh, Quận Tân Phú, TPHCM",250 m2,72 m2 (4x18),4,5,Sổ hồng,"✅BẢO SƠN RESIDENCE💥Tổ hợp khu phố thương gia sầm uất kinh doanh mọi ngành nghề - Trung tâm quận Tân PhúChính thức trải nhựa, hạ điện âm bàn giao cho khách👉Còn 1 căn 1 trệt 2 lầu 1 tum hoàn thiện 100% vào ở ngay 👉Diện tích: 72m2 (4x18)✅Giá chốt: 15,2 tỷ 📲 0349854941",15 tỷ 200 triệu
21432907,01/12/2021,"Nguyễn Sơn, Phường Phú Thạnh, Quận Tân Phú, TPHCM",280 m2,92 m2 (4x23),6,7,Sổ hồng,"🌈Chỉ còn 1 căn duy nhấtChính chủ Chưa Qua KD☘Mặt tiền Nguyễn Sơn, P. Phú Thạnh, Q . Tân Phú, Tp Hcm☘Diện tích 4x23 ☘️1 Trệt, 4 lầu, 1 phòng khách, 2 phòng đa năng, 4 phòng ngủ, 7 wc☘️ căn nhà được tích hợp thang máy và các thiết bị cảm ứng thông minh hiện đại nhất✅Giá : Liên hệ☘Tiện Mở Spa, Văn phòng Công ty Buôn Bán, phù hợp gia đình 3 thế hệ ☘️Bán Kính 500m đầy Đủ tiện ÍchSân bay TSN 12 phútAeon Mall 5 phútCoop mart BMC 3 phútchợ Bàu Cát 3 phútTrường học các cấp, bệnh viện Tân Phú, Thống Nhất..Hotline: ______0349.854.941______0909730392",28 tỷ 500 triệu
